area,url,category,title,date,id,comment,body
三島市,http://www.city.mishima.shizuoka.jp/ipn000793.html, 利子補給,三島市中小企業経済変動特別対策資金利子補給 ,2022-03-30,,,
三島市,https://www.city.mishima.shizuoka.jp/ipn034188.html, 融資,中小企業信用保険法（セーフティネット5号）について ,2022-03-30,,,
三島市,https://www.city.mishima.shizuoka.jp/ipn045206.html, 相談,新型コロナウイルスに関する相談・問い合わせ窓口 ,2022-03-30,,,
三島市,https://www.city.mishima.shizuoka.jp/ipn052330.html,,【三島市】補助金：「運送事業者支援補助金」,2022-10-31,87426,※2022年10月1日更新　申請期限2022年12月28日,
三島市,https://www.city.mishima.shizuoka.jp/ipn052453.html,,【三島市】補助金：「中小企業者等緊急支援補助金」,2022-10-31,87425,※2022年10月14日更新　申請期限2022年12月28日,
