area,url,category,title,date,id,comment,body
下田市,https://www.city.shimoda.shizuoka.jp/category/060100syoukougyou/149138.html, 補助金,下田市サテライトオフィス等整備費補助金 ,2022-03-30,,,
下田市,https://www.city.shimoda.shizuoka.jp/category/060100syoukougyou/148098.html, 補助金,下田市経済変動対策貸付(新型コロナウイルス感染症対応枠)利子補給 ,2022-03-30,,,
下田市,https://www.city.shimoda.shizuoka.jp/category/060100syoukougyou/147707.html, 融資・利子補給,下田市小口資金融資・利子補給制度 ,2022-03-30,,,
下田市,https://www.city.shimoda.shizuoka.jp/category/060100syoukougyou/147305.html, 融資,【新型コロナウイルス関係】セーフティネット保証4号・5号の認定について ,2022-03-30,,,
下田市,https://www.city.shimoda.shizuoka.jp/category/060100syoukougyou/147296.html, 支援情報,新型コロナウイルスの影響を受けた事業者の方への支援策について ,2022-03-30,,,
下田市,https://www.city.shimoda.shizuoka.jp/category/060100syoukougyou/150619.html,,【下田市】補助金：「原油価格・物価高騰対応事業者支援給付金について」,2022-08-29,83043,※2022年8月19日更新　申請期限2022年9月30日,
