area,url,category,title,date,id,comment,body
大分市,https://www.city.oita.oita.jp/o155/shigotosangyo/kigyoshien/safetynet4_covid19.html, 融資,新型コロナウイルス感染症の影響にかかる中小企業者対策としてセーフティネット保証4号についてお知らせします ,2022-03-30,,,
大分市,https://www.city.oita.oita.jp/o155/shigotosangyo/kigyoshien/safetynet-5-2021.html, 融資,セーフティネット保証5号 ,2022-03-30,,,
大分市,https://www.city.oita.oita.jp/o155/shigotosangyo/kigyoshien/coronataisaku.html, 融資,新型コロナウイルスに関する中小企業者等への金融対策 ,2022-03-30,,,
大分市,http://www.city.oita.oita.jp/o154/omotenasi2022.html,,【大分市】コロナに関する情報提供：「【令和4年度後期】中小企業者・小規模事業者等が行う新型コロナウイルス感染症対策等の取り組みに係る経費を一部補助します（大分市安心おもてなしステップアップ支援事業補助金）」,2022-08-30,83173,※2022年8月25日更新　申請期限2022年12月23日,
大分市,https://www.city.oita.oita.jp/o171/hojyokin.html,,【大分市】補助金・助成金：「大分市交通事業者事業継続支援事業補助金」の募集についてお知らせします,2023-07-28,107379,※2023年7月27日更新　申請期限2023年8月22日,
