area,url,category,title,date
安芸高田市,https://www.akitakata.jp/ja/shisei/section/syoukou/y481/, 補助金,安芸高田市雇用調整助成金活用促進事業補助金 ,2022-02-27
安芸高田市,https://www.akitakata.jp/ja/shisei/section/syoukou/c124/, 助成金,安芸高田市サテライトオフィス進出助成金 ,2022-02-27
安芸高田市,https://www.akitakata.jp/ja/shisei/section/syoukou/z174/,, 新型コロナウイルス感染症に係るセーフティネット保証（4号・5号）の認定受付について ,2022-02-27
安芸高田市,https://www.akitakata.jp/ja/a122/corona-shien-02/, 支援情報,新型コロナウイルス感染症関係支援情報（事業者向け） ,2022-02-27
安芸高田市,https://www.akitakata.jp/ja/shisei/section/gesui/z141/, 税制,上下水道料金の支払いの猶予について ,2022-02-27
安芸高田市,https://www.akitakata.jp/ja/a122/corona-shien-01/, 支援情報,新型コロナウイルス感染症関係支援情報（個人向け） ,2022-02-27
安芸高田市,https://www.akitakata.jp/ja/a122/, 支援情報,新型コロナウイルス感染症関連情報 ,2022-02-27
