area,url,category,title,date
高千穂町,https://www.town-takachiho.jp/korona/kinkyutaisakujigyou/1867.html, 補助金,［まとめ］第2弾 支え合おう高千穂！緊急対策事業 ,2022-01-05
高千穂町,https://www.town-takachiho.jp/korona/kinkyutaisakujigyou/1863.html, 補助金,高千穂町新型コロナウイルス感染症緊急対策利子補給補助金 ,2022-01-05
高千穂町,https://www.town-takachiho.jp/korona/kinkyutaisakujigyou/1868.html, 融資,高千穂町特別融資制度の変更について ,2022-01-05
高千穂町,https://www.town-takachiho.jp/korona/kinkyutaisakujigyou/1869.html, 融資,新型コロナウイルス感染症に係る資金繰り支援について ,2022-01-05
高千穂町,https://www.town-takachiho.jp/top/sangyo/shoko/831.html,, 【中小企業者の皆様へ】新たな設備等導入による生産性向上を応援します ,2022-01-05
