area,url,category,title,date
上天草市,https://www.city.kamiamakusa.kumamoto.jp/q/aview/706/12977.html, 補助金,上天草市新型コロナウイルス感染症対策雇用維持補助金 ,2022-02-17
上天草市,https://www.city.kamiamakusa.kumamoto.jp/q/aview/49/14820.html, 補助金,コロナ禍からの復興イベント等補助金 ,2022-02-17
上天草市,https://www.city.kamiamakusa.kumamoto.jp/q/aview/706/12519.html, 補助金,上天草市新型コロナウイルス感染症対策に伴う農林漁業者の資金繰りを支援する利子補給補助金 ,2022-02-17
上天草市,https://www.city.kamiamakusa.kumamoto.jp/q/aview/706/13774.html, 補助金,上天草市新型コロナウイルス感染症対策対策消毒費支援補助金 ,2022-02-17
上天草市,https://www.city.kamiamakusa.kumamoto.jp/q/aview/486/14580.html,, 中小企業の設備投資を支援します ,2022-02-17
上天草市,https://www.city.kamiamakusa.kumamoto.jp/q/aview/706/12520.html, 支援情報,新型コロナウイルス感染症の影響を受けている上天草市内事業者の皆さまへ ,2022-02-17
上天草市,https://www.city.kamiamakusa.kumamoto.jp/q/aview/706/14456.html, 支援情報,新型コロナウイルス感染症対策に伴う各種支援制度のお知らせについて ,2022-02-17
上天草市,https://www.city.kamiamakusa.kumamoto.jp/q/list/706.html, 支援情報,「支援制度（事業者向け）」の記事一覧 ,2022-02-17
