area,url,category,title,date
宇土市,https://www.city.uto.lg.jp/article/view/1243/2517.html, 給付金,宇土市飲食店等の時短要請等に伴う関連事業者給付金（令和3年8月・9月分） ,2021-11-15
宇土市,https://www.city.uto.lg.jp/article/view/1243/1276.html, 給付金,宇土市飲食店等の時短要請等に伴う関連事業者給付金（令和3年5月・6月分） ,2021-11-15
宇土市,https://www.city.uto.lg.jp/article/view/1243/1277.html, 給付金,宇土市賃料等負担軽減給付金 ,2021-11-15
宇土市,https://www.city.uto.lg.jp/article/view/1077/1268.html, 助成金,宇土市コロナ危機脱却助成金 ,2021-11-15
宇土市,https://www.city.uto.lg.jp/article/view/1077/1765.html, 給付金,宇土市農林漁業者事業継続対策給付金 ,2021-11-15
宇土市,https://www.city.uto.lg.jp/article/view/1111/1220.html,, セーフティネット保証4号について(突発的災害(自然災害等)) ,2021-11-15
宇土市,https://www.city.uto.lg.jp/article/view/1077/1261.html,, セーフティネット保証5号の認定について(新型コロナウイルス感染症に伴う5号認定) ,2021-11-15
宇土市,https://www.city.uto.lg.jp/article/view/1115/1238.html,, 中小企業等経営強化法に基づく「先端設備等導入計画」の認定受付について ,2021-11-15
