area,url,category,title,date
中間市,http://www.city.nakama.lg.jp/hayamimi/kyouryokuitizikin.html, 補助金,中間市感染防止対策協力一時金について ,2021-12-06
中間市,http://www.city.nakama.lg.jp/sangyo/shokogyo/corona4.html, 融資,新型コロナウイルス感染症に係るセーフティネット保証4号制度について ,2021-12-06
中間市,http://www.city.nakama.lg.jp/sangyo/shokogyo/safetynet5.html, 融資,新型コロナウイルス感染症に係るセーフティネット保証5号制度について ,2021-12-06
中間市,http://www.city.nakama.lg.jp/sangyo/shokogyo/kikikanren.html, 融資,危機関連保証の制度について（新型コロナウイルス感染症に係る） ,2021-12-06
中間市,http://www.city.nakama.lg.jp/sangyo/shokogyo/nakamadounyusokushinkeikaku.html,, 中小企業等経営強化法に基づく先端設備等導入計画について ,2021-12-06
中間市,http://www.city.nakama.lg.jp/sangyo/shokogyo/saigai.html, 融資,中間市中小企業融資制度,2021-12-06
