area,url,category,title,date
宮若市,https://www.city.miyawaka.lg.jp/kiji003447832/index.html, 補助金,宮若市飲食店取引先事業者後期支援金,2021-12-27
宮若市,https://www.city.miyawaka.lg.jp/kiji003446694/index.html, 補助金,宮若市新規事業所開設支援補助金・宮若市新規創業融資資金利子補充金,2021-12-27
宮若市,https://www.city.miyawaka.lg.jp/kiji003447497/index.html, 融資,中小企業者向けのセーフティネット保証4号制度について(新型コロナウイルス感染症関連) ,2021-12-27
宮若市,https://www.city.miyawaka.lg.jp/kiji003445348/index.html, 融資,中小企業者向けのセーフティネット保証(5号）(新型コロナウイルス関連) ,2021-12-27
宮若市,https://www.city.miyawaka.lg.jp/kiji003447518/index.html, 融資,中小企業者向けのセーフティネット保証-危機関連保証-（令和2年新型コロナウイルス感染症） ,2021-12-27
宮若市,https://www.city.miyawaka.lg.jp/kiji003446976/index.html,, 中小企業等経営強化法に基づく先端設備等導入計画の申請 ,2021-12-27
宮若市,https://www.city.miyawaka.lg.jp/kiji003447600/index.html, 相談,経営状況が悪化している事業者について（新型コロナウイルス感染症対策） ,2021-12-27
宮若市,https://www.city.miyawaka.lg.jp/kiji003447509/index.html, 支援情報,新型コロナウイルス感染症拡大に伴う中小企業者支援について【市内事業者】 ,2021-12-27
宮若市,https://www.city.miyawaka.lg.jp/kiji003447558/index.html, 支援情報,市内飲食店の応援プロジェクトを始めました！〔#tko_miyawaka〕 ,2021-12-27
