area,url,category,title,date
鞍手町,https://www.town.kurate.lg.jp/syouhi/syogyotenp_reformhojyokin.html, 補助金,鞍手町商業店舗リフォーム補助金 ,2022-03-16
鞍手町,https://www.town.kurate.lg.jp/syouhi/syouhin_kaihatu.html, 補助金,商品開発支援事業補助金,2022-03-16
鞍手町,https://www.town.kurate.lg.jp/syouhi/safetynet4.html, 融資,中小企業に対してのセーフティネット保証4号認定（新型コロナウイルス感染症関連） ,2022-03-16
鞍手町,https://www.town.kurate.lg.jp/syouhi/safetynet.html, 融資,中小企業に対してのセーフティネット保証5号認定について ,2022-03-16
鞍手町,https://www.town.kurate.lg.jp/new/kinkyukasituke_covid-19.html, 貸付,新型コロナウイルス感染症の影響による一時的な資金の緊急貸付について（個人向け） ,2022-03-16
鞍手町,http://www.town.kurate.lg.jp/syouhi/sogyosien_nintei.html, 融資,産業競争力強化法に基づく「創業支援事業計画」の認定について,2022-03-16
