area,url,category,title,date
市川市,https://www.city.ichikawa.lg.jp/eco01/1111000003.html, 融資,市川市中小企業融資制度 ,2021-12-21
市川市,https://www.city.ichikawa.lg.jp/eco01/1111000194.html, 利子補給,新型コロナウイルス感染症に係る資金の市川市信用保証料補助及び利子補給制度 ,2021-12-21
市川市,https://www.city.ichikawa.lg.jp/eco01/1111000197.html, 融資,セーフティネット保証4号認定について ,2021-12-21
市川市,https://www.city.ichikawa.lg.jp/eco01/1111000196.html, 融資,セーフティネット保証5号認定について ,2021-12-21
市川市,https://www.city.ichikawa.lg.jp/eco01/1111000199.html, 融資,危機関連保証認定について ,2021-12-21
市川市,https://www.city.ichikawa.lg.jp/eco01/1111000165.html,, 生産性向上特別措置法に基づく先端設備等導入計画について ,2021-12-21
市川市,https://www.city.ichikawa.lg.jp/cri03/callcenter.html, 相談,新型コロナウイルスに関するコールセンターの開設について ,2021-12-21
市川市,https://www.city.ichikawa.lg.jp/eco05/1111000010.html, 相談,よろず支援拠点（サテライト相談所）の経営相談 ,2021-12-21
