area,url,category,title,date
成田市,https://www.city.narita.chiba.jp/business/page152800.html, 融資,中小企業金融支援 ,2021-12-11
成田市,https://www.city.narita.chiba.jp/business/page153600.html,, 中小企業者向け緊急保証制度について ,2021-12-11
成田市,https://www.city.narita.chiba.jp/business/page153600_00003.html, 融資,セーフティネット保証4号・5号、危機関連保証について ,2021-12-11
成田市,https://www.city.narita.chiba.jp/business/page0137_00019.html,, 中小企業等経営強化法に基づく「先端設備等導入計画」の認定及び固定資産税(償却資産及び事業用家屋)の特例について ,2021-12-11
成田市,https://www.city.narita.chiba.jp/business/page0137_00050.html, 支援情報,新型コロナウイルス感染症に関する中小企業者の皆様への支援 ,2021-12-11
成田市,https://www.city.narita.chiba.jp/business/page0137_00051.html, 相談,新型コロナウイルスに関する中小企業等相談窓口について ,2021-12-11
