area,url,category,title,date
八街市,https://www.city.yachimata.lg.jp/soshiki/20/1355.html, 融資,八街市中小企業資金融資制度 ,2022-03-19
八街市,https://www.city.yachimata.lg.jp/soshiki/20/19836.html, 融資,新型コロナウイルス感染症に係るセーフティネット保証制度について ,2022-03-19
八街市,https://www.city.yachimata.lg.jp/soshiki/20/7749.html,, 先端設備等の導入を考えている方のための支援情報 ,2022-03-19
八街市,https://www.city.yachimata.lg.jp/site/covid-19/20676.html, 支援情報,新型コロナウイルス感染症に関する各種支援情報 ,2022-03-19
八街市,https://www.city.yachimata.lg.jp/soshiki/20/20615.html, 支援情報,新型コロナウィルス感染症の影響を受けた中小企業者に対する支援について ,2022-03-19
