area,url,category,title,date
印西市,https://www.city.inzai.lg.jp/0000001059.html, 融資,印西市中小企業資金融資制度  ,2022-01-10
印西市,https://www.city.inzai.lg.jp/0000006486.html, 利子補給,小規模事業者経営改善資金（マル経融資）利子補給金制度  ,2022-01-10
印西市,https://www.city.inzai.lg.jp/0000010430.html, 融資,新型コロナウイルス感染症に係るセーフティネット資金（市町村認定枠）（中小企業信用保険法第2条第5項第4号の規定による認定申請書） ,2022-01-10
印西市,https://www.city.inzai.lg.jp/0000007961.html,, 中小企業等経営強化法に基づく「導入促進基本計画」及び「先端設備等導入計画」について ,2022-01-10
印西市,https://www.city.inzai.lg.jp/0000012080.html, 支援情報,新型コロナウイルス感染症対策の支援など（事業者向け） ,2022-01-10
印西市,https://www.city.inzai.lg.jp/0000011581.html, 支援情報,事業者の皆様へ「印西市　新型コロナ対策」ステッカー・ポスターをご活用ください ,2022-01-10
