area,url,category,title,date,id,comment,body
赤穂市,https://www.city.ako.lg.jp/kensetsu/shoukou/cyuusyoukigyouyuusi.html, 融資,赤穂市中小企業経営安定資金融資のご案内 ,2022-03-30,,,
赤穂市,https://www.city.ako.lg.jp/kensetsu/shoukou/2201_sefetynet_4gou.html, 融資,新型コロナウイルス感染症に係るセーフティネット保証制度4号（自然災害等）の認定について ,2022-03-30,,,
赤穂市,https://www.city.ako.lg.jp/kensetsu/shoukou/safetynet5.html, 融資,セーフティネット保証5号（業況の悪化している業種（全国的））の認定について ,2022-03-30,,,
赤穂市,https://www.city.ako.lg.jp/kensetsu/shoukou/tokubetusotihou.html, 融資,中小企業等経営強化法に基づく「先端設備等導入計画」の認定申請受付について ,2022-03-30,,,
赤穂市,https://www.city.ako.lg.jp/kensetsu/shoukou/colona_shikinguri.html, 融資,中小企業向け新型コロナウイルス感染症に係る資金繰り支援 ,2022-03-30,,,
赤穂市,https://www.city.ako.lg.jp/kensetsu/shoukou/colona_soudan.html, 相談,【事業者向け】新型コロナウイルス感染症に関する経営相談窓口 ,2022-03-30,,,
赤穂市,http://www.city.ako.lg.jp/kensetsu/shoukou/2022_shienkyuufukin.html,,【赤穂市】補助金：「あこう中小企業者等支援給付金」,2022-07-28,80951,※2022年7月1日更新　申請期限2022年9月30日,
赤穂市,http://www.city.ako.lg.jp/kenkou/kaigo/keizokusien.html,,【赤穂市】補助金・助成金：「（事業所向け）介護サービス事業所等継続支援事業補助金について」,2023-01-11,92477,※2022年12月23日更新　申請期限2023年2月28日,
