area,url,category,title,date
小野市,https://www.city.ono.hyogo.jp/1/8/32/g167/1/q304/, 融資,新型コロナウイルス感染症に伴うセーフティネット保証4号の指定について ,2022-02-20
小野市,https://www.city.ono.hyogo.jp/1/8/32/g167/1/5/, 融資,中小企業信用保険法第2条第5項に基づく認定 ,2022-02-20
小野市,https://www.city.ono.hyogo.jp/1/8/32/g167/a140/, 融資,「先端設備等導入計画」の申請を受付しています ,2022-02-20
小野市,https://www.city.ono.hyogo.jp/1/8/32/g167/1/2/, 融資,小野市中小企業融資あっせん制度 ,2022-02-20
小野市,https://www.city.ono.hyogo.jp/1/10/1/3/e143/, 税制,新型コロナウイルス感染症等に係る中小事業者等が所有する事業用家屋及び償却資産に対する固定資産税及び都市計画税の特例措置に関する申告書 ,2022-02-20
小野市,https://www.city.ono.hyogo.jp/1/8/19/1/m116/, 税制,新型コロナウイルス感染症緊急経済対策における税制措置について ,2022-02-20
小野市,https://www.city.ono.hyogo.jp/1/8/100/q128/,, 新型コロナウイルス感染症に係る緊急対策事業一覧 ,2022-02-20
