area,url,category,title,date,id,comment,body
稲美町,https://www.town.hyogo-inami.lg.jp/0000000461.html, 補給金,稲美町緊急支援小規模企業等融資保証料補給金交付制度 ,2022-03-30,,,
稲美町,https://www.town.hyogo-inami.lg.jp/0000005289.html, 融資,新型コロナウイルス感染症に係るセーフティネット保証第4号(中小企業信用保険法第2条第5項第4号)について ,2022-03-30,,,
稲美町,https://www.town.hyogo-inami.lg.jp/0000001068.html, 融資,中小企業信用保険法第2条第5項第5号(セーフティネット)認定申請 ,2022-03-30,,,
稲美町,https://www.town.hyogo-inami.lg.jp/0000003910.html, 融資,中小企業等経営強化法に基づく支援 ,2022-03-30,,,
稲美町,https://www.town.hyogo-inami.lg.jp/0000004609.html,, 中小企業・小規模事業者に対する支援内容の情報提供について ,2022-03-30,,,
稲美町,https://www.town.hyogo-inami.lg.jp/0000005720.html,,【稲美町】補助金：「稲美町農業者支援臨時給付金のお知らせ」,2022-11-02,87765,※2022年11月1日更新　申請期限2022年12月28日,
