url,title,subtitle,category,tags,date,body
https://j-net21.smrj.go.jp/handbook/succession/succession.html,事業承継をサポートする仕組み,,経営ハンドブック,"事業承継,支援情報",2023-04-19,経営ハンドブック事業承継をサポートする仕組み事業承継支援情報2023年4月19日支援機関を活用することで事業承継を円滑に経営者の高齢化と後継者不足に悩む中小企業が生き残るために、事業承継は必ず乗り越えなくてはならない問題だ。現在では行政や民間の様々なサポートが用意されている。経営者は一人で抱え込まずに、こうしたサポートを積極的に利用することで、事業承継を円滑に進めていただきたい。ここでは親族内承継と従業員承継、そして社外への引継ぎ（M&A）と、それぞれの場合において、利用可能なサポート方法を挙げてみた。事業承継は早めに取り組むことが成功の鍵とされるので、ぜひ検討していただきたい。事業承継をサポートする仕組みのポイント事業承継を全般的にサポートする公的機関親族内承継の場合従業員承継の場合社外への引継ぎ（M&A）の場合1.事業承継を全般的にサポートする公的機関最初に相談したいのは、事業承継・引継ぎ支援センターだ。全国47都道府県において、事業承継全般に関する相談対応や事業承継計画の策定、M&Aのマッチング支援などを、原則無料でワンストップ支援を行っている。【主な支援内容】事業承継・引継ぎ（親族内・第三者）に関する相談事業承継診断による事業承継・引継ぎに向けた課題の抽出事業承継を進めるための事業承継計画の策定支援事業引継ぎにおける譲受／譲渡企業を見つけるためのマッチング支援経営者保証解除に向けた専門家支援など（一部地域では支援内容が異なる。専門家派遣には費用負担が発生することがある）▼事業承継・引継ぎ支援センターの連絡先一覧https://www.chusho.meti.go.jp/zaimu/shoukei/download/210401contact.pdf2.親族内承継の場合親族内承継について、人（経営）、資産、知的資産の三要素、さらに資産の中でも債務の承継、後継者による資金調達などといった面をサポートする仕組みについて紹介する。1.人（経営）の承継他の類型と比較すると、税負担への対応や株式・事業用資産の分散防止、債務の承継への対応に関して特に大きな課題が発生しやすいので注意する。後継者との対話後継者教育（社内・社外）関係者との事前協議経営の承継の実行【後継者教育をサポート】商工会・商工会議所や金融機関等が主催する「後継者塾」や「経営革新塾」などに後継者を参加させる。▼全国の商工会議所https://www5.cin.or.jp/ccilist▼全国の商工会・都道府県商工会連合会https://www.shokokai.or.jp/?page_id=1754▼中小企業大学校経営後継者研修https://www.smrj.go.jp/institute/tokyo/training/sme/succession/index.html【承継の実行をサポート】▼日本弁護士連合会では、中小企業の事業者向け専用ダイヤル「ひまわりほっとダイヤル」を開設している。全国共通TEL：0570-001-240https://www.nichibenren.or.jp/ja/sme/index.html▼日本司法書士会連合会https://www.shiho-shoshi.or.jp▼日本税理士会連合会https://www.nichizeiren.or.jp2.財産の承継〜税負担への対応〜親族内承継においては、先代経営者から後継者に対し、株式や事業用資産を贈与・相続により移転する方法が多い。この場合、贈与税・相続税の負担が発生するが、事業承継直後の後継者には資金力が不足していることが多い。従って可能な限り速やかに税務面は税理士に、資金調達については金融機関に相談するなど、支援機関に適切な助言を仰ぐべきである。1.暦年課税贈与https://www.nta.go.jp/taxes/shiraberu/taxanswer/zoyo/4408.htm2.相続時精算課税贈与https://www.nta.go.jp/taxes/shiraberu/taxanswer/sozoku/4103.htm3.法人版事業承継税制（特例措置）https://www.chusho.meti.go.jp/zaimu/shoukei/shoukei_enkatsu_zouyo_souzoku.htm4.法人版事業承継税制（一般措置）https://www.chusho.meti.go.jp/zaimu/shoukei/shoukei_enkatsu_gensoku_yoshiki.htm5.個人版事業承継税制https://www.chusho.meti.go.jp/zaimu/shoukei/shoukei_kojin_ninntei.htm6.経営資源集約化税制（中小企業事業再編投資損失準備金）https://www.chusho.meti.go.jp/keiei/kyoka/shigenshuyaku_zeisei.html7.登録免許税・不動産取得税の特例https://www.chusho.meti.go.jp/zaimu/zeisei/pamphlet/zeisei.pdf#page=59#【税負担への対応をサポート】▼日本税理士会連合会https://www.nichizeiren.or.jp▼金融機関の連絡先各金融機関のホームページ参照3.財産の承継〜株式・事業用資産の分散防止〜株式の相続に際して、遺産分割等の結果によっては、株式が多数の相続人に分散してしまう場合がある。株主管理コストが増えるだけでなく、場合によっては株式の買取りを請求され会社の資金流出が生ずるという事態もあり得る。生前贈与安定株主の導入遺言の活用遺留分に関する民法特例https://www.chusho.meti.go.jp/zaimu/shoukei/shoukei_enkatsu/minpou_kaisya.pdf【株式・事業用資産の分散防止をサポート】▼日本税理士会連合会https://www.nichizeiren.or.jp【遺言の活用をサポート】▼中小企業向け専用ダイヤル「ひまわりほっとダイヤル」／日本弁護士連合会全国共通TEL：0570-001-240https://www.nichibenren.or.jp/ja/sme/index.html▼日本司法書士会連合会https://www.shiho-shoshi.or.jp4.債務・保証・担保の承継債務、保証、担保等については、その処理を確実に行わなければ、円滑な事業承継の実現が困難になるばかりか、かかる負担が重荷となり、後継者が承継を断念する可能性もある。事業承継に向けて、経営改善を通じた資金繰りの改善により債務の圧縮を図りながら、金融機関との信頼関係を構築することが重要だ。対応する必要性は高い経営者保証に関するガイドラインに即した対応https://www.zenginkyo.or.jp/fileadmin/res/abstract/adr/sme/guideline_sp.pdf【債務・保証・担保の承継をサポート】金融機関は、中小企業に日常的に接して経営状況を把握しており、中小企業に対してきめ細やかな経営支援等を実施し得る立場にあるので、こちらから相談を持ちかける。▼金融機関の連絡先各金融機関のホームページ参照5.資金調達事業承継を行うに当たっては、以下に例示する一定の資金が必要となる一方、多額の資金が必要になることや、経営者交代に伴い信用状態が悪化して金融機関からの借入条件や取引先の支払条件が厳しくなること等が懸念される。1.事業承継時にかかる資金事業承継前に自社の磨き上げのためにかかる投資資金先代経営者からの株式や事業用資産の買取資金相続に伴い分散した株式や事業用資産の買取資金先代経営者の株式や事業用資産にかかる相続税・贈与税の納税資金事業承継後に経営改善や経営革新を図るための投資資金2.事業承継時の金融支援（経営承継円滑化法）【資金調達をサポート】▼株式会社日本政策金融公庫の融資中小企業・小規模事業者向けの政府系金融機関。経営承継円滑化法における都道府県知事の認定を前提に、後継者個人の株式取得資金の融資が可能https://www.jfc.go.jp/▼信用保証協会の保証枠の別枠整備中小企業が金融機関から事業資金を調達する際に「信用保証」を行う機関https://www.zenshinhoren.or.jp/3.従業員承継の場合従業員承継については、一般に後継者が将来経営者になることについての認識が弱いこと、後継者である家族や、現経営者の親族といった関係者の理解を得ることが容易でないこと、株式や事業用資産を有償譲渡する場合の買取資金の調達が容易でないことなどの問題があり、時間をかけて進めていたにもかかわらず、最後の段階で頓挫してしまうことも少なくない。1.人（経営）の承継従業員承継のメリットの1つは、経営者としての能力がある人材を見極めて承継させることができる点である。ただ、後継者の選定は、親族内承継と比べると通念上の正当性が弱いため、他の役員・従業員が納得できるよう慎重に進めることが重要だ。実際従業員承継では選定理由として「社内でのコミュニケーション能力」といった資質・能力が顕著に重視されている（「事業承継ガイドライン（第3版）」中小企業庁令和4年）。これに失敗すると、他の役員・従業員の士気を低下させ反発した役員・従業員が得意先を持って独立する事態を引き起こすこともある。後継者候補との対話が重要後継者教育親族内承継と違って、従業員承継では、将来経営者になることを、後継者が早い段階から意識していることはあまりない。そのため早い段階から育成していかなくてはならない。具体的にはa)経理、総務、営業から経営企画に至るまで幅広い業務を経験させること、b)後継者塾や経営会合等に参加させること、c)社内の重要プロジェクトを遂行させることなどが考えられる。他の役員・従業員の理解、協力現経営者の親族や取引先の理解、協力種類株式の活用【後継者教育をサポート】▼全国の商工会議所https://www5.cin.or.jp/ccilist▼全国の商工会・都道府県商工会連合会https://www.shokokai.or.jp/?page_id=1754▼中小企業大学校https://www.smrj.go.jp/institute/tokyo/training/sme/succession/index.html2.後継者による資金調達（MBO・EBO）後継者の軽度を安定させるためには、一定数の株式や事業用資産の取得が必要だ。この方法は、MBO（役員による株式取得）やEBO（従業員による株式取得）など、有償の譲渡により事業承継が行われることが多い。後継者（役員・従業員）が、自己資金や金融機関から借入れにより対象会社の株式を取得する特別目的会社（SPC）を設立し、ファンドやVCがSPCに出資する。SPCが自己資金の不足分を金融機関から借入れSPCが現経営者から対象会社株式を買い取り、対象会社を子会社化対象会社からSPCへの配当などにより金融機関からの借入れを返済【後継者による資金調達（MBO・EBO）をサポート】▼ファンドから投資を受けたいhttps://www.smrj.go.jp/sme/funding/fund/index.html▼事業承継・引継ぎ補助金https://jsh.go.jp3.株式分散の防止（親族内承継「3.財産の承継〜株式・事業用資産の分散防止〜」を参照）4.債務・保証・担保の承継現経営者の個人保証を引き継ぐことに、後継者の家族が反対して事業承継が断念された例もある。債務整理や経営者保証に関するガイドラインの活用等を通して処理方法を検討することが望ましい。https://www.zenginkyo.or.jp/fileadmin/res/abstract/adr/sme/guideline_sp.pdf【債務・保証・担保の承継をサポート】▼金融機関の連絡先各金融機関のホームページ参照4.社外への引継ぎ（M&A）の場合後継者不在の中小企業にとっては、M&Aを早期に検討して実現に持っていくことにより、従業員の雇用を確保し地域のサプライチェーンを維持できる可能性もある。また、譲渡側経営者にとっては、手元に残る代金が多くなる可能性もある。1.譲渡側にとっての留意点企業のマッチングには、通常数か月から1年ほどかかるため、できるだけ早期に判断して動き出すことが必要となる。また、M&Aの手続き全般にわたり、秘密を厳守し情報の漏えいを防ぐことが極めて重要だ。2.M&Aの手続き後継者不在が明らかになる身近な支援機関に相談する【サポート】商工団体、税理士、金融機関、中小企業診断士（コンサルタントや経営指導員）、公認会計士、弁護士、M&A専門業者、事業承継・引継ぎ支援センター仲介者・FAを選定する※選定しない場合はこれ以降を全て自社の力で行うバリュエーション（企業価値評価・事業価値評価）【サポート】税理士、金融機関、M&A専門業者譲受側の選定（マッチング）【サポート】M&A専門業者、金融機関、事業承継・引継ぎ支援センター交渉【サポート】弁護士（代理人として委任）、M&A専門業者、金融機関、事業承継・引継ぎ支援センター基本合意の締結【サポート】中小企業診断士、弁護士、事業承継・引継ぎ支援センターデュー・ディリジェンス（DD：買収者が買収対象企業の財務情報等を入手し、それが真実であるかどうか調査すること）【サポート】中小企業診断士、弁護士、事業承継・引継ぎ支援センター最終契約の締結【サポート】弁護士、M&A専門業者、金融機関、事業承継・引継ぎ支援センタークロージング【サポート】弁護士、M&A専門業者、金融機関、事業承継・引継ぎ支援センタークロージング後【サポート】士業等専門家、M&A専門業者、金融機関3.M&Aの支援機関譲渡側経営者が単独でM&Aを検討していても、なかなか進まないことが多い。まず行うべきことは、身近な支援機関への相談だ。▼M&Aについて相談できる支援機関商工団体（商工会・商工会議所等）、士業専門家（公認会計士・税理士・中小企業診断士・弁護士等）、金融機関、M&A専門業者、事業承継・引継ぎ支援センターなど。これらのほかに、近年急速に普及しつつあるのが「M&Aプラットホーム」だ。これは、インターネット上のシステムを利用して、オンラインで譲渡側と譲受側のマッチングの場を提供するウェブサイトである。民間のM&A専門業者については、「中小M&Aガイドライン」の遵守等を登録要件とする「M&A支援機関登録制度」（中小企業庁）がある。また、M&A仲介業の健全な発展を図る民間の自主規制団体として、「中小M&Aガイドライン」を含む適正な取引ルールの徹底等の活動を行う「一般社団法人M&A仲介協会」がある。▼M&A支援機関登録制度https://ma-shienkikan.go.jp/▼一般社団法人M&A仲介協会https://www.ma-chukai.or.jp/シェアツイートLINEで送る同じテーマの記事事業承継のための準備公的支援の受け方事業承継をサポートする仕組み後継者の選択と育成株主・金融機関対応方法M&Aの活用法従業員承継の方法と注意点廃業の留意点と進め方事業承継を進めたい関連リンクビジネスQ&A（事業承継）事業承継に関するQ&Aを掲載しています。事業承継・引継ぎはいま経営者がいつ、どのように自社の事業を引き継いだのか、話を聞きました。事業承継・M&A事業承継・M&A税制について解説しています。
https://j-net21.smrj.go.jp/news/hgc8pd00000014c2.html,「事業承継・引継ぎ補助金」第5次公募開始,中小企業庁,支援,支援情報,2023-04-19,支援「事業承継・引継ぎ補助金」第5次公募開始：中小企業庁支援情報2023年4月19日中小企業庁は、中小企業の事業承継やM&A（事業再編・事業統合）を契機とした経営革新への挑戦などを支援する「事業承継・引継ぎ補助金」（5次公募）の申請受付を始めた。補助額は最大800万円。申請期限は5月12日(予定)。補助事業は、「経営革新事業」「専門家活用事業」「廃業・再チャレンジ事業」の3種類ある。このうち、「経営革新事業」は、事業承継やM&Aを契機に事業再構築、設備投資、販路開拓などの経営革新に挑戦する費用を補助する。補助額は600万円が上限だが、一定の賃上げを実施する場合は補助上限を800万円に引き上げる。また、今回の公募から、同一法人内で承継予定の後継者候補による取り組みも新たに補助対象とした。「専門家活用事業」は、M&Aに関連した専門家などの活用費用を補助する。補助上限は600万円。「廃業・再チャレンジ事業」は、再チャレンジを目的に既存事業を廃業するための費用を補助する。補助上限は150万円。詳しくは中小企業庁のホームページ、特設サイトへ。中小企業生産性革命推進事業「事業承継・引継ぎ補助金」(五次締切)の公募要領を公表します令和4年度補正予算事業承継・引継ぎ補助金WebサイトシェアツイートLINEで送る中小企業NEWSトップへ戻る
https://j-net21.smrj.go.jp/news/hgc8pd000000148j.html,中小企業向け知的財産活動支援に補助金,各経済産業局と沖縄総合事務局,支援,支援情報,2023-04-19,支援中小企業向け知的財産活動支援に補助金：各経済産業局と沖縄総合事務局支援情報2023年4月19日経済産業省の各経済産業局と内閣府の沖縄総合事務局は、管内の中小企業などに対する知的財産支援で先導的な取り組みを定着させる事業などを実施する産業支援機関に対し、費用の一部を補助する「中小企業等知的財産活動支援事業費補助金（中小企業知的財産支援事業）」の公募を行っている。公募期限は5月8日まで。支援の対象となる産業支援機関については都道府県の中小企業支援センターを想定。そのほか、金融機関、商工会・商工会議所、財団・社団法人、大学なども申請できる。中小企業の知的財産活用を促進するために、産業支援機関が実施している中小企業向け支援施策を拡充させる事業について、補助対象経費の2分の1以内で最大500万円を交付。また、中小企業の知的財産活用を促進するための先導的な仕組みづくりなどを重視した支援事業を地域に定着させる事業に対しては、定額で最大1000万円を補助する。詳しくは、各経産局のホームページへ。北海道経産局令和5年度中小企業等知的財産活動支援事業費補助金の公募を開始しました東北経産局令和5年度中小企業等知的財産活動支援事業費補助金（中小企業知的財産支援事業）公募のお知らせ関東経産局令和5年度「中小企業等知的財産活動支援事業費補助金（中小企業知的財産支援事業）」の公募情報中部経産局令和5年度中小企業等知的財産活動支援事業費補助金（中小企業知的財産支援事業）の募集について（募集期間：令和5年4月13日から5月8日まで）近畿経産局令和5年度中小企業等知的財産活動支援事業費補助金（中小企業知的財産支援事業）（新やる気補助金）公募内容中国経産局令和5年度中小企業等知的財産活動支援事業費補助金（中小企業知的財産支援事業）の公募について四国経産局令和5年度「中小企業等知的財産活動支援事業費補助金（中小企業知的財産支援事業）」の公募について九州経産局令和5年度中小企業等知的財産活動支援事業費補助金（中小企業知的財産支援事業）（新やる気補助金）の公募を開始します沖縄総合事務局令和５年度「中小企業等知的財産活動支援事業費補助金（中小企業知的財産支援事業）」の公募を開始しますシェアツイートLINEで送る中小企業NEWSトップへ戻る
https://j-net21.smrj.go.jp/news/hgc8pd000000146k.html,流域治水オフィシャルサポーター制度創設,国交省,支援,支援情報,2023-04-19,支援流域治水オフィシャルサポーター制度創設：国交省支援情報2023年4月19日国土交通省は、「流域治水」に取り組む企業・団体などを「オフィシャルサポーター」として認定する制度を創設し、認定の申請を受け付けている。募集期限は5月11日。流域全体で治水対策に取り組む「流域治水」では、企業・団体など多様な関係者との連携が重要となっている。サポーター制度では、流域治水に取り組む企業や流域治水の取り組みを支援する企業などを幅広く周知し、流域治水に資する取り組みを促進する。ウェブサイトやSNS、広報誌などでの情報掲載や広報資料の配布・掲示、自治体などとの防災連携の締結、防災活動への積極的な参加といった取り組みを通じて流域治水を推進することが認定の条件となる。詳しくは、国交省のホームページへ。流域治水オフィシャルサポーター制度の創設～流域治水の促進に取り組む企業等を募集～シェアツイートLINEで送る中小企業NEWSトップへ戻る
https://j-net21.smrj.go.jp/news/hgc8pd0000001d27.html,ぐんま技術革新チャレンジ補助金,太田市,支援,"生産性向上,支援情報",2023-04-20,支援ぐんま技術革新チャレンジ補助金：太田市生産性向上支援情報2023年4月20日群馬県太田市は新技術や新製品の開発に取り組む意欲のある中小企業を支援するため、群馬県と連携した補助金を募集する。対象事業は、中小企業者が自ら行う、ものづくりやサービス等に関する革新的な新技術・新製品の開発や地域特色を活かした新製品開発。補助限度額は80万円(市・県各40万円)で補助率は2分の1（小規模事業者は5分の4）。申請書類は群馬県と太田市分を用意し、合わせて太田市へ提出する。締め切りは5月12日。詳細は太田市のホームページへ。令和5年度ぐんま技術革新チャレンジ補助金募集のお知らせシェアツイートLINEで送る中小企業NEWSトップへ戻る
