url,title,subtitle,category,tags,date,body
https://j-net21.smrj.go.jp/news/fms6rv00000000vi.html,宴会場施設の運営事業者に支援金,秋田県大仙市,支援,支援情報,2023-02-07,支援宴会場施設の運営事業者に支援金：秋田県大仙市支援情報2023年2月7日秋田県大仙市は、新型コロナウイルスの感染拡大の影響で経営が悪化した宴会場施設の運営事業者に対し、30万～50万円の支援金を支給する「宴会場施設運営支援金」の申請を受け付けている。申請期限は2月28日。支援を受けられるのは、市内に本社・事業所があり、代表者が市内に住所を持っている事業者。「今後も事業継続する意思がある」「1室33平方メートル以上の面積があり、かつ、扉・ふすまで仕切られた宴会場を持っている」「令和4年と令和元年の年間売上額を比較して20%以上減少している個人事業主または、直近決算期の年間売上額と直近決算期から3期前の年間売上額を比較して20％以上減少した法人」などの一定の要件を満たす必要がある。詳しくは、大仙市のホームページへ。大仙市宴会場施設運営支援金についてシェアツイートLINEで送る中小企業NEWSトップへ戻る関連リンク新型コロナウイルス関連ニュース新型コロナウイルスに関連するニュースをまとめています。新型コロナウイルス関連（都道府県別）新型コロナウイルスに関する地域の補助金・助成金・融資の情報をまとめています。
https://j-net21.smrj.go.jp/news/fms6rv00000000tm.html,店舗を巡る消費喚起イベントに補助金最大80万円,愛知県豊橋市,支援,"商品開発・市場開拓,支援情報",2023-02-07,支援店舗を巡る消費喚起イベントに補助金最大80万円：愛知県豊橋市商品開発・市場開拓支援情報2023年2月7日愛知県豊橋市は、店舗を巡る消費喚起イベント開催を支援する「店舗めぐり消費喚起事業特別支援補助金」の申請を受け付けている。補助額は最大で80万円。長期化するコロナ禍や原材料・物価高の影響を受けている商業者の店舗売り上げ回復を後押しする。補助の対象となるのは、市内に本店がある中小企業者と、中小企業者で構成される団体（商店街組織は除く）。3月31日までの間に2週間以上継続して市内で開催し、複数の店舗を消費者に回遊させるイベントであること、6以上の店舗が参加すること、などの要件がある。宣伝用ポスター・パンフレットなどの印刷製本費や広告宣伝費、景品購入費などイベントに関連する経費について4分の3以内の範囲で補助する。申請期限は3月15日。詳しくは、豊橋市のホームページへ。店舗めぐり消費喚起事業特別支援補助金シェアツイートLINEで送る中小企業NEWSトップへ戻る
https://j-net21.smrj.go.jp/news/fms6rv00000000j9.html,「ふるさと産品」育成の取り組みを支援,福島県いわき市,支援,支援情報,2023-02-07,支援「ふるさと産品」育成の取り組みを支援：福島県いわき市支援情報2023年2月7日福島県いわき市は、ふるさと産品の育成などの事業に補助金を交付する「ふるさと産品育成事業補助金」の申請受け付けを始めた。募集期間は2月28日まで。（1）普及・宣伝、（2）販路開拓、（3）開発・育成、（4）その他—の4つの事業を支援する。補助率は対象経費の2分の1で、「普及・宣伝」「開発・育成」に関する事業については最大50万円、「販路開拓」に関する事業は最大10万円を補助する。「その他」については、その都度限度額を決定する。ふるさと産品の生産・加工する市内の業者で構成される団体を対象としているが、一部の事業については、生産者や加工業者が申請することができる。補助の期間は原則1年。3年を限度に継続を認めることがある。詳しくは、いわき市のホームページへ。「いわき市ふるさと産品育成事業補助金」申請団体等の募集についてシェアツイートLINEで送る中小企業NEWSトップへ戻る
https://j-net21.smrj.go.jp/news/fms6rv00000001w9.html,「高校生のための企業研究ガイド2023」を作成、高校2年生全員に配布,兵庫県,支援,"人材不足解消,支援情報",2023-02-08,支援「高校生のための企業研究ガイド2023」を作成、高校2年生全員に配布：兵庫県人材不足解消支援情報2023年2月8日兵庫県は、県内の中小企業など340社を掲載した「高校生のための企業研究ガイド2023」を作成した。中小企業の若手人材の確保が困難になっているなか、魅力ある地元企業を知ってもらおうというもので、県内の高校2年生全員約4万3000人（私立高校、高専を含む）に配付していく。ガイドブックは県下7地域に分けて作成。各地域を代表する企業や、BtoB企業で一般にはあまり知られていないものの高い技術・シェアを誇る企業、女性が活躍する企業などを掲載している。掲載数は、地域企業が1県民局・県民センターあたり30社、さらに県下共通で、女性が活躍する企業10社、学生に知ってもらいたい注目の企業20社、大学生が紹介する兵庫の企業10社となっている。詳しくは兵庫県のホームページへ。兵庫の経済を支える340社を掲載！「高校生のための企業研究ガイド2023」を全高校2年生に配付しますシェアツイートLINEで送る中小企業NEWSトップへ戻る
https://j-net21.smrj.go.jp/news/fms6rv00000003t5.html,エネルギー使用合理化シンポ,九州経産局,イベント,"支援情報,SDGs,省エネ",2023-02-09,イベントエネルギー使用合理化シンポ：九州経産局支援情報SDGs省エネ2023年2月9日九州経済産業局は省エネルギー月間である2月に、「エネルギー使用合理化シンポジウム」をオンライン開催する。ライブ配信は2月22日13時～16時（定員250人）、後日配信は2月27日10時～3月6日17時（定員なし）。各企業の経営者やエネルギー管理統括者を対象に、改正省エネ法・省エネ支援策の説明や省エネ対策の実践事例を紹介する。住環境計画研究所の中上英俊会長が「脱炭素社会を需要側から考える～家庭部門を例題として」をテーマに基調講演する。続いて資源エネルギー庁省エネルギー課が「省エネルギー法の改正について」と「省エネ支援策パッケージについて」を説明する。最後に大分キヤノン（大分県国東市）が省エネの取り組み事例を紹介する。詳しくは九州経産局のホームページへ。「令和4年度エネルギー使用合理化シンポジウム」を開催しますシェアツイートLINEで送る中小企業NEWSトップへ戻る
https://j-net21.smrj.go.jp/news/fms6rv00000003ra.html,省エネセミナー,北海道経産局,イベント,"支援情報,SDGs,省エネ",2023-02-09,イベント省エネセミナー：北海道経産局支援情報SDGs省エネ2023年2月9日北海道経済産業局は、省エネ政策や改正省エネ法の説明、省エネをベースとした取組事例を紹介する「2022年度省エネセミナー」を2月17日に開催する。場所は北海道経産局第1会議室（札幌市北区）で、同時にオンラインでも配信する。定員は会場50人程度、オンライン100人程度。対象は企業経営者・管理者・現場担当者ら。時間は15時～16時45分。プログラムは省エネ政策の動向、改正省エネ法の紹介、道内特定事業者における省エネ取組事例の紹介、北国の省エネ・新エネ大賞受賞事例の紹介。参加希望者は2月14日までに申し込む。詳しくは北海道経産局のホームページへ。2022年度省エネセミナーを開催しますシェアツイートLINEで送る中小企業NEWSトップへ戻る
https://j-net21.smrj.go.jp/news/fms6rv00000007i5.html,カーボンニュートラルセミナー,東北経産局,イベント,"支援情報,SDGs,省エネ",2023-02-14,イベントカーボンニュートラルセミナー：東北経産局支援情報SDGs省エネ2023年2月14日東北経済産業局は東北地域の更なる成長・脱炭素化を目指して「カーボンニュートラルセミナー」を2月22日にオンライン開催する。カーボンニュートラルの総論から省エネルギーや再生可能エネルギー、水素といった個別テーマについて、現状と今後の展望、各種支援施策を紹介する。時間は13時30分～16時30分。2月17日までに申し込む。経済産業省環境経済室が「中小企業を巡るカーボンニュートラルの動向」について紹介する。続いて、秋田住友ベークが「秋田住友ベークの省エネとカーボンニュートラルへの取組事例紹介」、ケディカが「我が社における省エネに向けた取組；出来るところから始める省エネ」、東北銀行が「東北銀行の地域脱炭素化支援について」、水素バリューチェーン推進協議会が「水素産業の現状と課題」をテーマに事例を発表する。東北経産局、中小機構、省エネルギーセンターから施策紹介もある。詳しくは東北経産局のホームページへ。カーボンニュートラルセミナーを開催しますシェアツイートLINEで送る中小企業NEWSトップへ戻る
https://j-net21.smrj.go.jp/news/fms6rv00000007cj.html,省エネ技術の研究開発に最大6.6億円,NEDO,支援,"支援情報,省エネ",2023-02-14,支援省エネ技術の研究開発に最大6.6億円：NEDO支援情報省エネ2023年2月14日新エネルギー・産業技術総合開発機構（NEDO）は「脱炭素社会実現に向けた省エネルギー技術の研究開発・社会実装促進プログラム」の公募を始めた。「個別課題」と「重点課題」の2つの枠組みがあり、個別課題の技術開発費上限は最大5億円（助成率は4分の3から2分の1）、重点課題は同10億円（同3分の2～2分の1）。3月13日まで申請を受け付ける。このうち個別課題推進スキームは、4段階に分けて助成するのが特徴。「FS調査」フェーズ（調査費上限は1000万円）は、技術シーズの事業性検討、開発シナリオ策定や省エネルギー効果を検討するための事前調査を助成する。このほか「インキュベーション研究開発」（同2000万円）、「実用化開発」（同3億円）、「実証開発」（同5億円）の3種類のフェーズがある。一方の重点課題推進スキームは、複数の事業者が相互に連携・協力して取り組むべきテーマ（技術開発課題）を設定し、省エネルギーを実現する技術開発。具体的には、柔軟性を確保した系統側／業務用・産業用高効率発電、高効率電気加熱、高効率空調、交通流制御システム、スマート物流システム、工場内モニタリング・制御技術、次世代省エネ機器、次世代受動素子・実装材料などを例示している。詳しくはNEDOのホームページへ。2023年度「脱炭素社会実現に向けた省エネルギー技術の研究開発・社会実装促進プログラム」に係る公募についてシェアツイートLINEで送る中小企業NEWSトップへ戻る
https://j-net21.smrj.go.jp/news/fms6rv00000007ao.html,改正省エネ法説明会 in 岡山,中国経産局,イベント,"支援情報,SDGs,省エネ",2023-02-14,イベント改正省エネ法説明会in岡山：中国経産局支援情報SDGs省エネ2023年2月14日中国経済産業局は2月の省エネルギー月間の行事として、「改正省エネ法説明会in岡山」を2月27日に岡山商工会議所（岡山市北区）とオンラインで開催する。工場・事業場・自治体などのエネルギー管理統括者・担当者らに、改正省エネ法の動向や補助事業など支援策を説明し、工場・事業場の省エネ取組事例を紹介する。定員は会場30人、オンライン500人。申込締切は2月20日。時間は13時30分～16時。まず中国経産局エネルギー対策課が改正省エネ法の動向について解説する。続いて岡山村田製作所（岡山県瀬戸内市、セラミック原料・多層デバイス製造）が「カーボンニュートラルに向けた再エネ、省エネ事例の紹介」をテーマに講演する。最後に三社電機製作所岡山工場が「重油から電気への燃料転換と空調設備の省エネ事例」と題して講演する。詳しくは中国経産局のホームページへ。令和4年度改正省エネ法説明会in岡山の開催シェアツイートLINEで送る中小企業NEWSトップへ戻る
https://j-net21.smrj.go.jp/news/fms6rv000000078t.html,エネルギー使用合理化シンポ,近畿経産局,イベント,"支援情報,SDGs,省エネ",2023-02-14,イベントエネルギー使用合理化シンポ：近畿経産局支援情報SDGs省エネ2023年2月14日近畿経済産業局は「エネルギー使用合理化シンポジウムin関西」を2月17日にアットビジネスセンター大阪梅田（大阪市北区）とオンラインで開催する。参考となる省エネ事例の発表や脱炭素に向けたサプライチェーン全体での省エネ推進事例、さらには改正省エネ法や省エネ支援策を説明する。時間は13時～17時40分。定員は会場50人、オンライン500人。国立環境研究所地球システム領域副領域長の江守正多東京大学教授が「気候変動のリスクと社会の大転換」、シグマクシスの前田雄大氏が「脱炭素時代の企業経営・地域デザインの在り方」をテーマに基調講演する。続いて大和ハウス工業の小山勝弘環境部長、キャットアイの三島大樹氏、堺市環境局カーボンニュートラル推進部の増田頂二氏が事例を発表する。事例発表と並行して別室で個別相談会も実施する。詳しくは近畿経産局のホームページへ。エネルギー使用合理化シンポジウムin関西シェアツイートLINEで送る中小企業NEWSトップへ戻る
https://j-net21.smrj.go.jp/news/fms6rv000000076y.html,エネルギー使用合理化シンポ,東北経産局,イベント,"支援情報,SDGs,省エネ",2023-02-14,イベントエネルギー使用合理化シンポ：東北経産局支援情報SDGs省エネ2023年2月14日東北経済産業局は2月の省エネルギー月間中のイベントとして、「エネルギー使用合理化シンポジウム東北」を2月21日に仙台市太白区文化センター（仙台市太白区）とオンラインで開催する。今年度の省エネ大賞資源エネルギー庁長官賞を受賞したデンソーなどの省エネ活動事例を紹介するとともに、経産省の支援施策、省エネ法改正について説明する。2月16日までに申し込む。時間は14時30分～16時30分。デンソー安全衛生環境部の安田純也担当係長と同社メカトロシス製造部の中島涼介氏が「意識・組織・アクションを変革するデータドリブンな省エネ活動」「高精度樹脂成形部品の製造工程最適化による省エネルギー活動」を紹介。続いてエネルギー管理優良工場東北経済産業局長賞を受賞したアルフレッサファインケミカル（秋田市、医薬品の原液製造）の今井卓也氏が「エネルギー利用高効率化提案と全社一丸省エネルギー活動展開」と題して講演する。詳しくは東北経産局のホームページへ。令和4年度「エネルギー使用合理化シンポジウム東北」を開催しますシェアツイートLINEで送る中小企業NEWSトップへ戻る
https://j-net21.smrj.go.jp/news/fms6rv00000009em.html,台風15号被災中小企業の復旧費用を最大100万円補助,静岡市,支援,支援情報,2023-02-15,支援台風15号被災中小企業の復旧費用を最大100万円補助：静岡市支援情報2023年2月15日静岡市は、2022年9月の台風15号による豪雨で被害を受けた市内の中小企業者の施設・設備などの復旧を支援する「被災中小企業再建支援事業等補助金」の申請受付を2月10日に開始した。施設の修繕費用などに最大100万円の補助金を交付する。補助の対象となるのは、業務用の施設・設備などに被害を受け、罹災証明書などの交付を受けた中小企業者・小規模事業者など。事務所や店舗、工場などの修繕や償却資産の修理・購入、業務用車両などの修理・購入などの費用を補助する。補助額は、中小企業者か小規模事業者か、県の補助金対象かどうかで変動する。中小企業者の場合、対象経費が40万円超100万円以下のケースで市の補助額は30万～75万円、100万円超のケースで25万～100万円となっている。詳しくは、静岡市のホームページへ。被災中小企業再建支援事業等補助金シェアツイートLINEで送る中小企業NEWSトップへ戻る
