url,title,subtitle,category,tags,date,body
https://j-net21.smrj.go.jp/special/business_support/20240527.html,“異業種”の食品会社5社が新商品開発・販路開拓にチャレンジ,伊予西条“発”食の物語チーム（愛媛県西条市）,経営支援の現場から,支援情報,2024-05-27,経営支援の現場から“異業種”の食品会社5社が新商品開発・販路開拓にチャレンジ：伊予西条“発”食の物語チーム（愛媛県西条市）支援情報2024年5月27日プロジェクト最終日に行われた商談会愛媛県西条市は自然環境に恵まれた都市だ。南に西日本最高峰の石鎚山を擁し、北は瀬戸内海と接する。地下にパイプを打ち込むだけで水があふれ出てくるほど地下水が豊富で、「うちぬき」と呼ばれる自噴井は名水百選にも選ばれている。温暖な気候と豊かな水資源をもとに四国有数の農業地帯として発展。瀬戸内ののりや魚介類などの水産業も盛んだ。恵まれた食資源をいかに地域の経済活性化に生かすか。西条市内で食品会社を経営する5人の経営者が2022年から中小機構四国本部の支援を受けながら、新商品の開発や販路開拓にチャレンジした。「伊予西条“発”食の物語チーム」と名付けられた2年間のプロジェクトを通じて地元の食材を活用した新商品を生み出し、全国発信している。プロジェクトは24年2月に終了し、5人のチャレンジは次のステップに向けて歩みだした。プロジェクト最終日「これからがスタート」プロジェクトのリーダー、かんこめ代表取締役の菅圭一郎氏「みな西条を代表する商売人、企業経営者として一人ひとりが、このプロジェクトに真摯に向き合ってくれた。商品を開発し、結果が出せたことは、ありがたいとともに頼もしいと感じた。こういう機会を得たことを本当に感謝している」。このプロジェクトのリーダーである有限会社かんこめ代表取締役、菅圭一郎氏は2月24日、西条市食の創造館で行われたプロジェクトの最後の会議で、参加したメンバーたちに感謝の言葉を投げかけた。この日は大阪と東京からバイヤーを招き、プロジェクトとして最後の商談会を開催。5人のメンバーが新たに開発した新商品を提案した。玄米入りのおはぎや肉団子など、いずれも今までにない新しい食感・味わいを感じる食品に仕上がった。バイヤーの評価も高く、商品化に向けてさらなる取り組みが進められることになった。アドバイザーの松原氏の話に耳を傾けるプロジェクトのメンバーらプロジェクトに参加したのは、それぞれが異なる分野の食品を扱う会社だ。リーダーの菅氏が経営する「かんこめ」は老舗米穀店。2004年から市内の契約栽培米を「うちぬき」で炊き上げた玄米おむすびを販売している。ネット通販で販売し、全国から注文が寄せられるほどの人気を集めている。マルノー物産株式会社は養豚と地域ブランドポーク「ひうちべっぴんポーク」の販売を手掛ける。ピーコックフーズ株式会社は食肉の加工品を販売。また、和洋菓子を製造販売する株式会社大阪屋は創業70年、海苔加工販売の四国海苔株式会社は創業100年の老舗企業。「西条を元気にすることをしよう」という菅氏の呼びかけに賛同して集まったメンバーだ。みな西条市を拠点に事業を展開し、地域を支える有力な事業者だが、ビジネスの拠点は愛媛県とその周辺が中心。ピーコックフーズの近藤正典社長は「地元のスーパーが主要な取引先だが、県外のチェーン店などが進出して厳しくなっていた。自分としても何か新しいことをしないといけないと考えていた矢先で、いいきっかけになると思って参加した」と語る。この日でプロジェクトは終了となったが、工夫を凝らした試作品の提案を受けたバイヤーからは「今回、改めていろいろなことを勉強させていただいた。われわれで力になれること、逆に力添えをいただけること、それをじっくりと膝をつき合わせて話し合いさせていただいて、この機会をいい方向に進めていきたい」と前向きな声をもらい、大きな自信を得た。「これからがスタート」「今後もこの5人で西条を盛り上げていこう」と、参加したメンバーは気持ちを新たにしていた。メンバー企業それぞれの経営改善もアドバイス商品開発に向けて5人は活発な議論を繰り広げたこのプロジェクトは、ビジネスの拡大を目指し、地域の中小企業グループが抱える共通課題の解決を支援する中小機構の「地域経済振興支援事業」を活用した取り組みだ。四国本部企業支援部長の中曽根保氏(肩書は取材当時)が、この支援を活用する事業者の掘り起こしをする中で、かんこめの菅氏とめぐりあった。「以前に中小機構の支援を活用された経験があり、新事業として始めた『玄米おむすび』をヒットさせた経営力を持たれている。事業グループでの取り組みができないか、地域経済振興支援事業を紹介させていただいた」と中曽根氏は語る。四国の事業者が直面する共通の課題は、人口減少による市場の縮小。約370万人いる四国4県の人口は2040年には300万人を割るという試算がある。今の高知県1県の人口がなくなる計算で、全国的にも早い速度で進んでいる。「人口減少の状況を考えると、外に売る力を持ちたい。それも1社だけでは難しいし、1社がよくても波及効果は薄い。5社くらい集まって取り組もうと考えた」と、菅氏は地域経済振興支援事業の活用を決め、青年会議所の活動などでふだんから付き合いがある経営者4人に声をかけた。プロジェクトは2022年9月に本格スタートした。中小機構は、大手流通企業の元役員で商品・原材料開発など豊富な経営経験を持つ松原覚アドバイザーを派遣した。「伊予西条“発”食の物語チーム」はアドバイザーがつけた名前だ。「発」には、地域のいいものや自社を「発見」する、もっと掘ればいいものがみつかるという「発掘」、新商品を「開発」する、そして、顧客への「発信」—。そんな意味が込められているという。アドバイザーのサポートは、単に商品開発や販路開拓にとどまらなかった。プロジェクトのキックオフ会議で、各社にプロジェクトに対する思いを聞き、第2回目の会議では、自社の将来像やどんな企業を目指すのかを聞いた。その間、メンバーの工場を個別に視察。各社の事業規模や生産管理体制などをチェックした。生産管理の改善点など個社の経営への取り組み方にも及んだ。自社の得意分野生かし、コラボ商品も開発マルノー物産の河村竜介社長とピーコックフーズの近藤正典社長大きな目標である商品開発では「何か一つのことをみんなでやろう」(菅氏)と、弁当づくりなども考えたそうだ。各社の生産力などを分析したアドバイザーの助言を受けながら、みなでいろいろな意見を出し合い、各社の得意とする分野をうまく生かしながら、新たな商品開発に取り組んだ。鶏肉団子に玄米を織り込んだ「玄米鶏肉団子」、べっぴんポークの「骨なしスペアリブ」、中華麺に青のりを練りこんだ「青のりラーメン」、青のりを使った「水餅」、鯛の風味をつけた「玄米鯛茶漬け」など…。翌年には各社が個性的な試作を提案した。メンバーから意見を聞きながら、さらに試作品をブラッシュアップし、中小機構が招いたバイヤーとの商談会が数度にわたって行われた。マルノー物産とピーコックフーズとのコラボで生まれた、ひうちべっぴんポークのソーセージ。カタログ販売もスタートしているこうした試作品の中で、地域ブランドである「ひうちべっぴんポーク」を加工したソーセージなどの商談が成立した。ピーコックフーズの近藤社長はドイツに留学して食肉加工の国家資格を得ており、その技術を生かしたマルノー物産社長の河村竜介氏とのコラボレーションの結果、この商品が生まれた。卸会社のバイヤーからは「この商品なら首都圏でも販売できる。新たな地域ブランドとして売り込みたい」との評価を受け、2024年2月にはカタログ販売がスタートした。支援を通じた販路開拓では、既存商品の販売拡大につながったケースがある。また、メンバーがアドバイスを参考に独自の販路拡大に取り組み、ビジネスにつなげたケースもあった。プロジェクト当初に行われた商談会での河村社長(左)と近藤社長(左から2人目)。バイヤーからのアドバイスも新製品開発の後押しになった新商品の開発では、アドバイザーだけでなく、まったく分野の異なるメンバーたちからの意見が大きな刺激になった。玄米肉団子では、「自分の常識では、肉団子の中に玄米を入れるという発想は出てこない。『玄米を入れたらどうか』というメンバーがいたので、半信半疑やってみたら『これはいける』となった」と近藤氏。味わいをよくするため、鶏肉から豚肉に素材を変えるなどメンバーのアドバイスを試作品の改良につなげている。一方、大阪屋代表取締役の山地良太氏が取り組む玄米おはぎでは、玄米の専門家である菅氏のサポートが開発を後押しした。玄米ともち米を使い、「企業秘密」(菅氏)という製法で、独特の食感を作り出した。完成したのは、プロジェクト最終日の前日だったそうだ。地元から全国へマーケットの視点が広がる最終日の商談会で大阪屋の山地良太代表取締役がバイヤーに提案した「玄米おはぎ」2年間にわたって5人の取り組みを見守ってきた中曽根氏。プロジェクトを推進するのにあたって気にかけていたのは、メンバーたちがメリットを感じてくれるようにプロジェクトを運営することだったという。「参加者がメリットを感じないと、途中から一人抜け二人抜けして、空中分解してしまうことも起こりうる。単なる勉強会に終わらせることなく、常にお互いを意識し、いつまでに何をすべきか確認しあいながら取り組んでもらった」メンバーたちはプロジェクトを通じて、大きな学びを得た。地元が中心だったビジネスの視点が全国へと大きく広がった。山地氏は「このプロジェクトがなければ、これまでの商圏でこれまで通りの仕事をしていただろう。だが、プロジェクトを通じて、全国規模のマーケットの大きさが如実に分かった。世間とはこういうものなのだと分かったことは大きな成果だった」と話す。四国海苔の鳥谷勇佑取締役(左)は東京のレストランとの商談で、製造販売する青のりのメニュー化を実現させた四国海苔取締役の鳥谷勇佑氏は「私は代表ではないが、(代表取締役の)父に連れられてこのプロジェクトに参加した。地域の小さい会社は打席に立つことすら厳しい。アドバイザーからいろいろな提案の機会をいただく中で、自分の課題、会社の課題、こういう会社にしたいという思いが固まってきた。今回が出発点で3年後、5年後、もっと先を見据えて成長していきたい」と語った。会社経営に対する意識を変えるプロジェクトでもあった。1本では簡単に折れてしまう矢も3本重ねると折ることができない—。瀬戸内海を挟んだ四国の対岸、中国地方を戦国時代に束ねた毛利元就が3人の子供たちに授けた「三本の矢の教え」だ。地域の小さな1社だけでは立ち向かえないことも同じ目標に向かう仲間が集まることで大きな力を生む。人口減、市場縮小という厳しい現実が迫る中、地域の企業同士の連携によって克服する力を発揮することができる。最終回の会議に参加した中小機構四国本部の樋口光生本部長は「野球にたとえれば、このプロジェクトは中継ぎみたいなもの。7回を投げて、8、9回と続く。これからの西条を盛り上げるために引き続き、皆さんと議論や意見を交換したい」と呼びかけた。各企業が抱える課題を解決するには、さらに長いスパンが必要となるものもある。参加した5人の経営者が紡ぐ「食の物語」が今後、西条市にどんな刺激を与え、全国に羽ばたくのか。そのエピローグが楽しみでならない。プロジェクトチームデータプロジェクトチーム名：伊予西条“発”食の物語チーム設立：2022年9月会員数：5事業者代表者：菅圭一郎氏（有限会社かんこめ）所在地：愛媛県西条市朔日市554-2シェアツイートLINEで送る経営支援の現場から関連リンクコミュニケーション力や事業者理解力がカギ商工会議所・商工会に今求められる「課題設定型支援」とは：埼玉県商工会議所連合会広域指導員・黒澤元国氏業務効率化と事業計画を意識した経営支援：坂東市商工会（茨城県坂東市）5年間で約100件の「経営力向上計画」を申請支援自社の経営を見つめ直す事業計画として活用：木更津商工会議所（千葉県木更津市）広域指導員をフル活用し、若手を育成：川越商工会議所（埼玉県川越市）経験豊かな外部人材を登用、厚みある広域指導を実現：上田商工会議所（長野県上田市）伴走から自走へ—事業者の「気づき＋行動」を促す支援に注力：深谷商工会議所（埼玉県深谷市）頼られる存在へ事業を一新。デジタル駆使で小規模の弱みをカバー：島田市商工会（静岡県島田市）専門家のスキル学ぶ貴重な機会に：所沢商工会議所（埼玉県所沢市）一過性の支援ではなく、次の100年もあり続ける企業の支援に向けて：土浦商工会議所（茨城県土浦市）「進取の精神」で新しい支援手法を学ぶ：高崎商工会議所（群馬県高崎市）ベテランも若手も成長し、地域の企業を支える：前橋商工会議所（群馬県前橋市）金融機関巻き込み、経営課題に踏み込んだ伴走支援を実現：三重県信用保証協会「課題設定型支援」OJT事業の中間報告会を開催：関東経産局関東経済産業局は3月14日、商工会議所の経営指導員を対象に行った「経営力再構築伴走支援に係るOJT事業」の中間報告会をさいたま市内で開催した。中小企業の挑戦を応援する5つの報告書及びガイドラインを公表：経済産業省経済産業省・中小企業庁は、中小企業の成長を応援する5つの報告書とガイドラインを公表した。コロナ禍からの回復や人口減少、DXなど構造的な変化が進む中で、日本が更なる成長を実現するには、中小企業の成長が重要と指摘、伴走支援の強化など実現のための施策を提示した。中小企業診断士の有資格者を中心に、独自の課題設定型支援を開始：浜松商工会議所（静岡県浜松市）今年4月に創立130周年の節目を迎えた浜松商工会議所は「経営力強化と変革への挑戦」とのスローガンを掲げ、「ウィズ・アフターコロナにおける中小・小規模企業の挑戦支援」に取り組んでいる。
https://j-net21.smrj.go.jp/topics/2024/j84vtt000000yx1r.html,経営支援の現場から「“異業種”の食品会社5社が新商品開発・販路開拓にチャレンジ,伊予西条“発”食の物語チーム（愛媛県西条市）」,,支援情報,2024-05-27,経営支援の現場から「“異業種”の食品会社5社が新商品開発・販路開拓にチャレンジ：伊予西条“発”食の物語チーム（愛媛県西条市）」支援情報
https://j-net21.smrj.go.jp/news/j84vtt0000016fs8.html,海外出願支援、愛知・岐阜・三重・富山の各県で事業者募集,中部経産局,支援,"支援情報,海外展開",2024-05-28,支援海外出願支援、愛知・岐阜・三重・富山の各県で事業者募集：中部経産局支援情報海外展開2024年5月28日中部経済産業局は、外国への事業展開などを計画している中小企業などに対して特許などの外国出願費用の半額を助成する「中小企業等海外展開支援事業費補助金（海外出願支援事業）」について、愛知・岐阜・三重・富山の各県で事業者の申請を受け付けている。申請期限は、愛知県が6月7日、富山県が6月20日、三重県が6月21日、岐阜県が6月28日。補助額は、1企業に対する上限が300万円（1事業年度内）。案件ごとの上限は、特許が150万円、実用新案・意匠・商標が60万円、冒認対策商標(第三者による抜け駆け出願の対策を目的とした商標出願)が30万円。補助率は、外国特許庁への出願料や現地代理人費用など対象経費の2分の1以内。助成の対象となるのは、中小企業者か、中小企業者が3分の2以上を占めるグループ。地域団体商標の外国出願については商工会議所、商工会、NPO法人なども支援を受けることができる。申請窓口は以下の通り。愛知県あいち産業振興機構(名古屋市中村区)岐阜県県産業経済振興センター(岐阜市)、三重県県産業支援センター(津市)富山県県新世紀産業機構(富山市)詳しくは、中部経済産業局のホームページへ。令和6年度中小企業等海外展開支援事業費補助金（海外出願支援事業）シェアツイートLINEで送る中小企業NEWSトップへ戻る
https://j-net21.smrj.go.jp/news/j84vtt0000016faz.html,小麦・大豆加工事業者向け支援説明会を開催,東北・関東など6地方農政局,支援,支援情報,2024-05-28,支援小麦・大豆加工事業者向け支援説明会を開催：東北・関東など6地方農政局支援情報2024年5月28日農林水産省は、小麦や大豆を加工する食品事業者向けの支援措置が新設された特定農産加工業経営改善臨時措置法の一部改正に関する説明会を東北・関東・北陸・東海・近畿・中国四国の各ブロックで開催する。制度の活用を推進する観点から小麦・大豆を主要原材料として使用している事業者を対象に改正法の内容や関連する補助事業などについて説明する。開催日程は、東北ブロックが6月7日、仙台合同庁舎B棟(仙台市青葉区)。定員は会場50人、オンライン(MicrosoftTeams)100人。申し込み期限は5月31日。関東ブロックは6月21日、さいたま新都心合同庁舎検査棟(さいたま市中央区)。定員は会場30人、オンライン（MicrosoftTeams）200人。申し込み期限は6月14日。北陸ブロックは6月25日、金沢広坂合同庁舎(金沢市)。定員は会場20人で、オンライン（MicrosoftTeams）でも参加できる。申し込み期限は6月20日。東海ブロックは6月14日、東海農政局(名古屋市中区)。定員は会場30人、オンライン（MicrosoftTeams）200人。申し込み期限は6月7日。近畿ブロックは6月12日、オンライン（Webex)のみ。申し込み期限は6月7日。中国四国ブロックは6月11日、岡山第2合同庁舎(岡山市北区)。定員は会場40人、オンライン（MicrosoftTeams）300人。申し込み期限は6月7日。いずれも先着順。参加無料。特定農産加工業経営改善臨時措置法は、関税引き下げなどの影響を受けた食品加工事業者などに対して長期低利融資など金融・税制面で優遇措置を講じ、経営改善を支援する法律。今回の改正で期限が5年間延長されたほか、国際情勢の変化による小麦・大豆の国際価格の高まりを受け、小麦や大豆を加工する食品事業者向けの支援措置を新設した。7月1日に施行される予定。詳しくは、各地方農政局のホームページへ。特定農産加工業経営改善臨時措置法の一部改正に関する東北ブロック説明会（2024年6月7日）のお知らせ(東北農政局)「特定農産加工業経営改善臨時措置法」の一部改正に関する関東ブロック説明会の開催について(関東農政局)特定農産加工業経営改善臨時措置法等に関する北陸ブロック説明会開催及び参加者の募集について(北陸農政局)「特定農産加工業経営改善臨時措置法」の一部改正に関する東海ブロック説明会の参加者を募集します(東海農政局)特定農産加工業経営改善臨時措置法の一部改正に関する説明会(近畿農政局)特定農産加工業経営改善臨時措置法の一部改正に関する中国四国ブロック説明会の開催について(中国四国農政局)シェアツイートLINEで送る中小企業NEWSトップへ戻る
https://j-net21.smrj.go.jp/news/j84vtt0000016f90.html,ICT海外展開セミナー6月4日開催,北海道総通局,支援,"支援情報,海外展開",2024-05-28,支援ICT海外展開セミナー6月4日開催：北海道総通局支援情報海外展開2024年5月28日北海道総合通信局は、デジタル技術の海外展開に取り組む中小企業などを対象に「ICT海外展開セミナー」を札幌第1合同庁舎(札幌市北区)で開催する。参加申し込みの締め切りは5月31日。地域に根差したICT中小企業の海外展開の取り組みを支援する「デジタル海外展開支援事業」の令和6年地方枠について総務省国際戦略局が説明するほか、ICT事業者の海外展開を支援する官民ファンド、海外通信・放送・郵便事業支援機構(JICT)が海外展開の推進に向けた自社の取り組みを紹介する。また、国際協力機構(JICA)のモンゴル、バングラディシュ、ルワンダの各事務所が海外展開案件の形成に向けた現地のICT事情やニーズなどの情報を提供する。定員は40人。参加費は無料。詳しくは、北海道総合通信局のホームページへ。「ICT海外展開セミナー」の開催－海外展開案件形成に向けた最新情報を提供－シェアツイートLINEで送る中小企業NEWSトップへ戻る
https://j-net21.smrj.go.jp/news/j84vtt0000016gb0.html,奥能登地域の被災事業者への相談に対応するサテライトオフィスを開設,中小企業庁,支援,"支援情報,能登半島地震",2024-05-29,支援奥能登地域の被災事業者への相談に対応するサテライトオフィスを開設：中小企業庁支援情報能登半島地震2024年5月29日経済産業省・中小企業庁は、奥能登地域の被災事業者への相談体制を拡充するため、6月3日に能登空港（通称「のと里山空港」）内に「能登産業復興相談センター奥能登サテライトオフィス」を開設する。能登半島地震からの復旧・復興に向けた資金繰り支援を始めとする各種相談に対応する。震災前の借入金の返済負担が大きく、金融機関から新規融資を受けることが困難となっている、いわゆる二重債務問題に直面している事業者について、金融機関と調整の上、能登半島地震復興支援ファンドが金融機関から債権を買い取るまでの手続きを支援する。主な業務内容1．ワンストップ相談窓口業務（関係支援機関・支援施策の紹介等）2．事業計画・再生計画の策定支援3．ファンドによる債権買取等の支援詳細は中小企業庁のホームページまで。「能登産業復興相談センター奥能登サテライトオフィス」の開設についてシェアツイートLINEで送る中小企業NEWSトップへ戻る
