url,title,subtitle,category,tags,date,body
https://j-net21.smrj.go.jp/accounts/tax_benefits/20230310.html,賃上げ促進税制,,中小企業の税金と会計,"強い組織作り,資金繰り改善,支援情報",2023-03-10,中小企業の税金と会計賃上げ促進税制強い組織作り資金繰り改善支援情報2023年3月10日1．中小企業向け賃上げ促進税制とは中小企業向け「賃上げ促進税制」は、「中小企業者等が、前年度より給与等を増加させた場合に、その増加額の一部を法人税（個人事業主は所得税）から税額控除できる」という制度です。ここでいう「中小企業者等」というのは、青色申告書を提出する者のうち、以下に該当するもののことを指すとされています。(1)以下のいずれかに該当する法人資本金の額または出資金の額が1億円以下の法人（ただし大規模法人から2分の1以上の出資を受ける法人と、2以上の大規模法人から3分の2以上の出資を受ける法人は対象外）資本または出資を有しない法人のうち常時使用する従業員数が1000人以下の法人(2)常時使用する従業員数が1000人以下の個人事業主(3)協同組合等（中小企業等協同組合、出資組合である商工組合等）また、ここで言う「給与等」というのは、俸給・給料・賃金・歳費及び賞与並びに、これらの性質を有する給与（所得税法第28条第1項に規定する給与等）のことをいいます。2．賃上げ促進税制の概要(1)適用要件は次の通り。—必須要件—【通常要件】雇用者に支払う給与等の額が前年度と比べて1.5％以上増加した場合⇒控除対象となる雇用者に支払う給与等の増加額の15％を法人税額または所得税額から控除。あるいは【上乗せ要件①】雇用者に支払う給与等の額が前年度と比べて2.5％以上増加した場合⇒通常要件（15％）に15％上乗せとなり、合計で30％の税額控除になります。—追加要件—【上乗せ要件②】教育訓練費の額が前年度と比べて10％以上増加した場合⇒上乗せ要件①（30％）に更に10％上乗せとなり、合計で40％の税額控除となります。▼賃上げ促進税制の適用要件(2)前述の上乗せ要件②でいう「教育訓練費」とは、国内雇用者の職務に必要な技術又は知識を習得させ、又は向上させるために支出する費用のうち一定のものをいいます。具体的には以下を言います。法人が教育訓練等を自ら行う場合の費用（外部講師謝金等、外部施設使用料等）他の者に委託して教育訓練等を行わせる場合の費用（研修委託費等）他の者が行う教育訓練等に参加させる場合の費用（外部研修参加費等）など※控除対象となる雇用者給与等支給増加額は、調整雇用者給与等支給増加額が上限となります。※税額控除額は、法人税額または所得税額の20％（通常・上乗せ共通）が上限となります。3．令和4年改正による主な変更点令和4年4月の改正以前は「所得拡大促進税制」とされ、令和3年4月1日から令和4年3月31日までの間に開始する事業年度が対象でした。令和4年度の税制改正により「賃上げ促進税制」となり、令和4年4月1日から令和6年3月31日までの間に開始する各事業年度が適用期間となります。個人事業主については令和5年から令和6年までの各年が対象になります。【令和4年改正の特長】(1)上乗せ要件を簡素化し、控除率を引き上げました旧制度では25％だった控除率が最大40％になりました。(2)教育訓練費増加要件に係る明細書の「添付義務」が「保存義務」に変更されました明細書には、実施年月（「日」は任意）、実施内容、受講者名、支払証明（領収書のコピー等）を明記することになります。(3)経営力向上要件が廃止されました所得拡大促進税制では適用年度の終了の日までに、中小企業等経営強化法に基づく経営力向上計画の認定を受けており、経営力向上計画に基づき経営力向上が確実に行われたという証明がされていることが必要でした。それが令和4年改正によって廃止されました。4．要件判定の具体例(1)雇用者に支払う給与等の額が前事業年度と比べて1.5％以上増加—計算式—（当年度の雇用者に支払う給与等の額−前事業年度の給与等の支払額）÷前事業年度の給与等の支給額≧1.5％【A社の場合】前事業年度に雇用者へ支払った給与等の額5000万円当年度に雇用者へ支払った給与等の額5090万円—計算式—（5090万円−5000万円）÷5000万円＝0.0181.8％≧1.5％通常要件を満たしているので、15％の税額控除となります。(2)雇用者に支払う給与等の額が前事業年度と比べて2.5％以上増加—計算式—（当年度の雇用者に支払う給与等の額−前事業年度の給与等の支払額）÷前事業年度の給与等の支払額≧2.5％【B社の場合】前事業年度に雇用者へ支払った給与等の額5000万円当年度に雇用者へ支払った給与等の額5200万円—計算式—（5200万円−5000万円）÷5000万円＝0.044.0％≧2.5％通常要件と上乗せ要件①を満たしていることになります。この場合、通常要件の15％と上乗せ要件①の15％を足して、30％の税額控除になります。(3)教育訓練費の額が前事業年度と比べて10％以上増加—計算式—（当年度の教育訓練費の額−前事業年度の教育訓練費の額）÷前事業年度の教育訓練費の額≧10％【A社の場合】前事業年度の教育訓練費が50万円当年度の教育訓練費が58万円（58万円−50万円）÷50万円＝0.1616％≧10％通常要件15％＋上乗せ要件②10％＝25％の税額控除になります。【B社の場合】前事業年度の教育訓練費が50万円当年度の教育訓練費が58万円30％の税額控除にこの上乗せ要件②の10％を加えて、40％の税額控除となります。(4)給与等に充てるため、他の者から支払いを受ける金額がある場合この「給与等に充てるため、他の者から支払いを受ける金額」というのは、以下のことをいいます。補助金や助成金、給付金、負担金その他これらに準ずるもののうち、交付の趣旨・目的が給与等の支給額の負担軽減にあるもの、あるいはその交付額の算定方法が給与等の支給実績または支給単価を基礎として定められているもの。他の法人へ出向した者に対して、出向元から給与を支給する場合に、出向先法人から受けた出向先法人が負担すべき給与に相当する金額。（例）前事業年度に比較雇用者給与等支給額が5200万円、うち200万円は雇用安定助成金を受けている。当年度の雇用者に支払う給与等の額が5700万円、うち900万円は雇用安定助成金を受けている。この場合の給与等支払額の増加率は、以下の計算式のようになります。（4800万円−5000万円）÷5000万円＝△0.04雇用者に支払う給与等の額は前年より増えていますが、雇用安定助成金を除く額はマイナスになるため、通常要件を満たさないことになります。シェアツイートLINEで送る税制優遇
https://j-net21.smrj.go.jp/news/fms6rv00000010pn.html,観光地経営に関する動画公開,中小機構近畿,イベント,支援情報,2023-03-13,イベント観光地経営に関する動画公開：中小機構近畿支援情報2023年3月13日中小機構近畿本部は、1月31日に大阪国際ビルディング（大阪市中央区）で実施した「観光支援トークセッション」の様子を動画で公開した。近畿運輸局と連携して開催したもので、観光有識者らが「観光地経営」について議論するほか、2025年の大阪・関西万博を見据えた観光経営を実践するための課題、目指す方向性について提言した。中小機構近畿本部は2021年から、コロナ渦で疲弊した地域を応援する目的で「観光支援プログラム」を実施し、支援地域の自主マーケティングの取り組みや、DX（デジタルトランスフォーメーション）化の推進などの面から支援してきた。今回の動画では先進的な取り組みを進めた京都府京丹後市、同伊根町、奈良県斑鳩町、同明日香村の4地域の事例発表も行った。詳しくは中小機構近畿のニュースリリースへ。～2025年大阪・関西万博を目指して、これからの地域観光を考える～「観光支援トークセッション」の動画を公開しましたシェアツイートLINEで送る中小企業NEWSトップへ戻る
https://j-net21.smrj.go.jp/news/fms6rv00000010lp.html,商店街の活性化に最大3000万円,中企庁,支援,支援情報,2023-03-13,支援商店街の活性化に最大3000万円：中企庁支援情報2023年3月13日中小企業庁は商店街などを対象に、2022年度第2次補正予算「面的地域価値の向上・消費創出事業」の公募を始めた。コロナ禍による来街者ニーズの多様化や、足元の円安メリットを活かしたインバウンドの回復が期待される中、商店街が自らの魅力・地域資源を用いて実施する滞留・交流空間整備や消費創出事業を支援する。補助率は3分の2で、補助上限額は3000万円（下限額200万円）。4月10日まで申請を受け付ける。補助対象事業者は商店街組織や民間事業者と商店街組織の連携体。補助事業は（1）専門家による伴走支援（専門家が事業効果を定期的に確認しながら面的に伴走支援）（2）消費創出事業（回遊促進事業、体験事業、交流事業、ブランディング、情報発信強化など）（3）滞留・交流空間整備事業（空き地・空き店舗の利活用、店舗の機能転換、歩道の利活用、景観整備など）。（1）と（2）が事業計画に含まれていることが必須要件となる。詳しくは中企庁のホームページへ。令和4年度第2次補正予算「面的地域価値の向上・消費創出事業」の公募についてシェアツイートLINEで送る中小企業NEWSトップへ戻る
https://j-net21.smrj.go.jp/accounts/succession/20230315.html,事業承継に必要な資金は？,,中小企業の税金と会計,"事業承継,支援情報",2023-03-15,中小企業の税金と会計事業承継に必要な資金は？事業承継支援情報2023年3月15日近年中小企業の数が減少傾向にあります。とくに小規模企業の減少が著しいようです。その原因の一つとして、経営者の高齢化が進む一方で、後継者への事業承継が進んでいないことが挙げられます。そのために休廃業や解散を選択せざるを得なくなった企業が少なくないということです。事業承継の大切さはここで改めて言うまでもありませんが、さて実際に事業承継を進める際には、肝心の資金はどのように考えていったらよいのでしょうか。1．経営承継円滑化法に基づく認定事業承継の際に必要となる資金には次のようなものが考えられます。後継者が、相続等で分散した自社株式や事業用資産を買い取るための資金。後継者が、相続や贈与によって自社株式や事業用資産を取得した場合の資金。役員や従業員が、株式や事業の一部を買い取って事業の承継を行うための資金。経営者の交代により信用状態が悪化し、銀行の借入条件や取引先の支払条件が厳しくなった場合に対応する資金。これに対して、「中小企業における経営の承継の円滑化に関する法律」（以下「経営承継円滑化法」）では、中小企業の円滑な事業承継を支援するために次のような支援策が講じられています。税制支援遺留分に関する民法の特例金融支援所在不明株主に関する会社法の特例「税制支援」「金融支援」「所在不明株主に関する会社法の特例」については、各都道府県による認定が必要となります。「遺留分に関する民法の特例」については中小企業庁で確認を行っています。2．税制支援中小企業の円滑な事業承継を支援するため、相続税や贈与税について税制の特例があります。相続税については、現経営者の相続または遺贈により、後継者が取得した自社株式の80％部分の相続税の納税が猶予及び免除されます。贈与税については、現経営者からの贈与により、後継者が取得した自社株式に対応する贈与税の納税が猶予及び免除されます。1.納税猶予を受けるための主な要件(1)会社の要件中小企業者であること。上場会社・風俗営業会社でないこと。従業員が1人以上であること。資産保有型会社等に該当しないこと。(2)先代経営者の主な要件会社の代表者であったこと相続開始の直前又は贈与の直前において、現経営者と現経営者の親族などで総議決数の過半数を保有しており、かつこれらのものの中で筆頭株主であったこと。（贈与税の場合）贈与時に代表者を退任していること（有給役員として残ることは可）。(3)後継者の主な要件相続開始時または贈与時において、後継者と後継者の親族などで総議決数の過半数を保有し、かつこれらの者の中で筆頭株主であること。（相続税の場合）相続開始の直前において役員であり、相続開始から5か月後に代表者であること。（贈与税の場合）贈与時に20歳以上、贈与の直前において3年以上役員であり、かつ、代表者であること。2.納税猶予を受けるための手続き納税猶予を受けるためには、経営承継円滑化法に基づいて「都道府県知事の認定」と「税務署への申告」の手続きが必要となります。(1)相続税の場合(2)贈与税の場合3.納税猶予額が免除となるケース一定の条件（主なものを以下に例示）を満たす場合、納税猶予額が免除されます。(1)相続税後継者が死亡した場合(2)贈与税現経営者（贈与者）又は後継者（受贈者）が死亡した場合(3)相続税・贈与税共通申告期限後5年間において、やむを得ない理由により、後継者が代表権を有しなくなった日以後に、後継者が「猶与継続贈与」を行った場合申告期限後5年経過後に、後継者が「猶予継続贈与」を行った場合申告期限後5年経過後に、会社が破産手続開始の決定又は特別生産開始の命令等等を受けた場合3．金融支援会社や後継者である代表者あるいは個人事業主が資金を必要とする場合に、経営承継円滑化法における都道府県知事の認定を受けることを前提に、日本政策金融公庫および沖縄振興開発金融公庫による低利融資と、信用保証協会の信用保証の特例を受けることができます。事業承継に伴う幅広い資金ニーズに対応しており、M&Aにより他社の株式や事業用資産を買い取るための資金等も含まれます。対象は、中小企業者の代表者、事業を営んでいない個人。1.低利融資(1)融資が受けられる場合会社又は個人事業主が、後継者不在などにより事業継続が困難となっている会社から、事業や株式の譲渡などにより事業を承継する場合会社が株主から自社株式や事業用資産を買い取る場合後継者である個人事業主が、事業用資産を買い取る場合経営円滑化法に基づく認定を受けた会社の代表者個人が、自社株式や事業用資産の買い取りや、相続税の納税などを行う場合(2)融資の条件融資限度額：7億2000万円（うち運転資金4億8000万円）融資利率：通常1.2％の基準金利が適用されるところ、0.81%の特別利率を適用2.信用保証経営承継円滑化法に基づく認定を得た会社及び個人事業主が、事業承継に関する資金を金融機関から借り入れる場合には、中小企業信用保険法に規定されている普通保険、無担保保険、特別小口保険を別枠化することによって、信用保障協会の債務保証も実質的に別枠化されるため、中小企業者が当該債務保証を受けることで金融機関からの資金調達が行いやすくなります。3.認定申請書の主な記載事項提出先は各都道府県の担当課になります。(1)事業承継を行うこととなった原因先代経営者の死亡または代表者の退任(2)事業活動の継続に支障を生じさせる主な事由申請者が、申請者以外の者が有する株式を取得する必要があること。申請者が、申請者以外の者が有する事業用資産を取得する必要があること。申請者の売上高が減少することが見込まれること。仕入先からの取引条件について申請者の不利益となる設定又は変更が行われたこと。取引先金融機関との取引に支障が生じたこと。4．遺留分に関する民法の特例民法では、相続の公平性を確保するために、「遺留分」という最低限の相続権利（原則として法定相続分の2分の1）を保障しています。遺留分を侵害された相続人は、遺留分以上の財産を取得した相続人などに対し、侵害された分に相当する金銭の請求が認められています（「遺留分侵害額請求権」と呼ばれています）。旧代表者の遺産に占める自社株式や事業用資産の割合が大きい場合、後継者は他の相続人の遺留分を侵害する可能性が高く、紛争が起こるおそれがあります。そこで、経営承継円滑化法では、後継者が、遺留分権利者全員との合意及び所要の手続を経ることを前提として、遺留分に関する以下の特例制度（民法特例）を措置しています。1.除外合意後継者が先代経営者からの贈与等により取得した株式等・事業用資産の価額は、民法の規定によれば、原則として、相続開始前10年以内に行われたものに限り、「特別受益」として遺留分を算定するための財産の価額に算入され、遺留分の算定に影響します。しかしながら、当該株式等・事業用資産を除外合意の対象とすれば、その価額は遺留分を算定するための財産の価額に算入されなくなり、遺留分の算定に影響しなくなります。2.固定合意後継者が先代経営者からの贈与等により取得した株式等について、遺留分を算定するための財産の価額に算入する価額は、相続開始時を基準とする評価額です。例えば贈与時に3000万円だった自社株式の価値が相続開始時には1億2000万円に上昇していた場合には、その価値上昇が後継者の努力によるものであったとしても、上昇後の1億2000万円が遺留分を算定するための財産の価額に算入されます。これに対して、当該株式等を固定合意の対象とすれば、遺留分を算定するための財産の価額に算入すべき価額が3000万円となり、価値上昇分9000万円は遺留分を算定するための財産の価額に算入されなくなります。なお、除外合意と固定合意は二者択一ではなく、組み合わせることができます。例えば、後継者が旧代表者からの贈与等により取得した1000株のうち600株を除外合意の対象とし、残りの400株を固定合意の対象とすることも可能です。5．所在不明株主に関する会社法特例の前提となる認定中小企業では、一般に株主の数が少なく、各株主の議決権割合が高くなる傾向にあります。そのため、所在不明の株主がいる場合、事業承継が円滑に進まないことがあります。会社法では、所在不明株主に対して行う通知等が5年以上継続して到達しておらず、なおかつ5年以上剰余金の配当を受け取っていない場合、その保有株式の競売または売却（自社による買取を含む）の手続きが可能です。しかし、「5年」という長さが、事業承継の障害になっているという面もありました。この特例を利用するためには、次の2要件を満たして、各都道府県の担当課に申請書を提出する必要があります。1.経営困難要件以下のいずれかに該当する場合、要件を満たすことになります。代表者の「年齢」が満60歳を超えている場合代表者の「健康状態」が日常業務に支障を来している場合「その他の事情」が認められる場合（代表者以外の役員や幹部従業員の病気や事故等、外部環境の急激な変化による突然の業績悪化等）2.円滑承継困難要件(1)認定申請日時点において、株式会社事業後継者が定まっている場合【所在不明株主の保有株式の議決権割合】株式譲渡の手法：10分の1超かつ「1ー要求される割合（最低50％超）」超株式総会特別決議に基づく手法等：3分の1超(2)認定申請日時点において、株式会社事業後継者が未定の場合【所在不明株主の保有株式の議決権割合】原則：3分の1超例外：10分の1超かつ特例適用分が経営株主等と加算して10分の9以上申請書には、認定申請書の写し、登記事項証明書、定款の写し、株主名簿の写し、誓約書なども添付して提出します。6．事業承継に関するご相談は事業承継・引継ぎポータルサイトhttps://shoukei.smrj.go.jpシェアツイートLINEで送る事業承継・M&A
https://j-net21.smrj.go.jp/news/fms6rv0000005mq8.html,改正省エネ法のオンライン説明会,東北経産局,支援,支援情報,2023-03-22,支援改正省エネ法のオンライン説明会：東北経産局支援情報2023年3月22日東北経産局は、4月1日施行される改正省エネ法の説明会を3月29日、オンラインで開催する。改正省エネ法では、石油などの化石エネルギーに加え、太陽光発電などの再生可能エネルギーについても法律の対象に加え、徹底した省エネ対策を進めるとともに再生エネの利用拡大を図る。エネルギー使用量が一定規模以上の事業者に対しては、太陽光発電などの再生可能エネルギーへの転換に関する中長期計画の作成や利用状況などの定期報告が求められるほか、再生可能エネルギーの余剰を防ぎ、有効活用するための対応が求められる。セミナーでは、中小企業や特定事業者、自治体、団体などを対象に改正省エネ法の対応について説明するとともに、さらなる省エネ推進のための支援施策について紹介する。申し込み締め切りは3月27日。参加無料。詳しくは、東北経済産業局のホームページへ。「改正省エネ法・省エネ補助金等説明会」を開催しますシェアツイートLINEで送る中小企業NEWSトップへ戻る
https://j-net21.smrj.go.jp/news/fms6rv0000008kgt.html,補助金獲得支援セミナー開催,浜松地域イノベーション推進機構,支援,支援情報,2023-03-28,支援補助金獲得支援セミナー開催：浜松地域イノベーション推進機構支援情報2023年3月28日浜松地域イノベーション推進機構は浜松市をはじめ静岡県西部地域の自治体などとの共催で、「令和5年度補助金獲得支援セミナー」を4月14日、浜松市中区のグランドホテル浜松で開催する。事業活動を進める上で、有効な手段となる補助金の活用に向けて、経済産業省をはじめ、静岡県産業振興財団、浜松市、浜松地域イノベーション推進機構が実施する2023年度の各種補助金について、制度概要やその活用のポイントを紹介する。補助金に関心のある中小企業を対象にしており、定員は120人(先着順・事前申し込み制)。参加費は無料(県西部地域以外の企業は税込み1000円)。申込締切は4月12日。詳しくは、浜松地域イノベーション推進機構のホームページへ。【募集中】4/14「令和5年度補助金獲得支援セミナー」ご案内シェアツイートLINEで送る中小企業NEWSトップへ戻る
