area,url,category,title,date
いちき串木野市,http://www.city.ichikikushikino.lg.jp/shokan1/20200113.html, 補助金,いちき串木野市新型コロナウイルス関連緊急経営支援利子補助金 ,2021-12-21
いちき串木野市,http://www.city.ichikikushikino.lg.jp/shokan1/sangyo/shoko/safety-net.html, 融資,セーフティネット保証制度 ,2021-12-21
いちき串木野市,http://www.city.ichikikushikino.lg.jp/shokan1/seisannseikoujyou.html,, 中小企業等経営強化法に基づく「先端設備等導入計画」 ,2021-12-21
いちき串木野市,http://www.city.ichikikushikino.lg.jp/shokan1/20200317.html, 支援情報,新型コロナウィルス感染症で影響を受ける事業者の皆様へ ,2021-12-21
いちき串木野市,http://www.city.ichikikushikino.lg.jp/fukushi5/seikatufukushisikinkashituke.html, 貸付,新型コロナウイルス感染症の影響による一時的な資金の緊急貸付について(個人向け) ,2021-12-21
いちき串木野市,http://www.city.ichikikushikino.lg.jp/kodomo1/kosodate_rinjikyuufukin_2021.html, 給付金,令和3年度いちき串木野市子育て世帯等臨時特別支援事業(子育てへの臨時特別給付)について(個人向け) ,2021-12-21
