area,url,category,title,date,id,comment,body
萩市,https://www.city.hagi.lg.jp/soshiki/49/1660.html, 融資,セーフティネット保証制度のご案内 ,2022-03-30,,,
萩市,https://www.city.hagi.lg.jp/site/corona/h38659.html, 支援情報,がんばろう萩！萩市経済対策　一覧 ,2022-03-30,,,
萩市,https://www.city.hagi.lg.jp/soshiki/30/h31467.html, 税制,萩市税の徴収猶予 ,2022-03-30,,,
萩市,https://www.city.hagi.lg.jp/site/corona/h31529.html, 税制,水道料金・上下水道使用料のお支払い猶予、分割納付等のご相談 ,2022-03-30,,,
萩市,https://www.city.hagi.lg.jp/site/corona/h32265.html, 相談,新型コロナウイルス感染症に関する相談窓口 ,2022-03-30,,,
萩市,https://www.city.hagi.lg.jp/soshiki/49/h48536.html,, 【萩市】補助金：「がんばろう萩！原油価格・物価高騰対策支援金（8月から申請開始）」,2022-07-29,81088,※2022年7月21日更新　申請期限2022年11月30日,
