area,url,category,title,date,id,comment,body
戸田市,https://www.city.toda.saitama.jp/soshiki/214/keizai-yuushi-seido.html, 融資,戸田市中小企業融資制度 ,2022-03-30,,,
戸田市,https://www.city.toda.saitama.jp/soshiki/214/keizai-kikikannrihosyou.html, 融資,新型コロナウイルス関連のセーフティネット保証・危機関連保証について ,2022-03-30,,,
戸田市,https://www.city.toda.saitama.jp/soshiki/214/keizai-koron-kigyou.html,, 新型コロナウイルスに関する事業者向け情報 ,2022-03-30,,,
戸田市,https://www.toda.or.jp/news/287, 相談,新型コロナウイルスに関する経営相談窓口～戸田市商工会～ ,2022-03-30,,,
戸田市,https://www.city.toda.saitama.jp/soshiki/214/keizai-dxhojyo.html,,【戸田市】補助金・助成金：「戸田市DX推進補助金【第2回公募受付中！】」,2022-11-29,89723,※2022年11月14日更新　申請期限2022年12月19日,
