area,url,category,title,date,id,comment,body
伊奈町,https://www.town.saitama-ina.lg.jp/0000005339.html, 補助金,伊奈町中小企業資金融資制度等に係る保証料等補助金 ,2022-03-30,,,
伊奈町,https://www.town.saitama-ina.lg.jp/0000000257.html, 融資,伊奈町中小企業資金融資制度 ,2022-03-30,,,
伊奈町,https://www.town.saitama-ina.lg.jp/0000000255.html, 融資,セーフティネット保証制度 ,2022-03-30,,,
伊奈町,https://www.town.saitama-ina.lg.jp/0000005344.html, 税制,新型コロナウイルス感染症の影響による法人町民税の申告期限等の延長について ,2022-03-30,,,
伊奈町,https://www.town.saitama-ina.lg.jp/0000007223.html,,【伊奈町】補助金・助成金：「伊奈町介護事業所等緊急支援給付金」,2022-11-18,89095,※2022年10月31日更新　申請期限2023年1月31日,
