area,url,category,title,date
小川町,https://www.town.ogawa.saitama.jp/0000003807.html, 補助金,小川町中小企業者等感染対策支援補助金 ,2022-02-20
小川町,https://www.town.ogawa.saitama.jp/0000004278.html, 補助金,小川町経営革新計画等チャレンジ応援補助金 ,2022-02-20
小川町,https://www.town.ogawa.saitama.jp/0000003599.html, 融資,セーフティネット4号保証について ,2022-02-20
小川町,https://www.town.ogawa.saitama.jp/0000003605.html, 融資,セーフティネット5号保証について ,2022-02-20
小川町,https://www.town.ogawa.saitama.jp/0000002730.html,, 先端設備等導入計画について（中小企業等経営強化法） ,2022-02-20
小川町,https://www.town.ogawa.saitama.jp/0000003535.html,, 新型コロナウイルス感染症に関連した企業への支援について ,2022-02-20
