area,url,category,title,date
石井町,https://www.town.ishii.lg.jp/docs/2021102900010/, 給付金,石井町個人事業主等に対する新型コロナウイルス感染症傷病見舞金給付事業 ,2022-01-06
石井町,https://www.town.ishii.lg.jp/docs/2017072700019/, 補助金,石井町創業促進事業補助金 ,2022-01-06
石井町,https://www.town.ishii.lg.jp/docs/2020030400036/, 融資,セーフティネット保証4号の認定について（新型コロナウイルス感染症） ,2022-01-06
石井町,https://www.town.ishii.lg.jp/docs/2020031900030/, 融資,セーフティネット保証5号（全国的に業況の悪化している業種）の認定について ,2022-01-06
石井町,https://www.town.ishii.lg.jp/docs/2021070600028/,, 中小企業等経営強化法に基づく導入促進基本計画 ,2022-01-06
