area,url,category,title,date,id,comment,body
遠野市,"https://www.city.tono.iwate.jp/index.cfm/46,56310,295,586,html", 補助金,新型コロナウイルス感染症等経済対策「商い元気回復事業費補助金」 ,2022-03-30,,,
遠野市,"https://www.city.tono.iwate.jp/index.cfm/46,20323,295,524,html", 融資,遠野市融資制度のご案内 ,2022-03-30,,,
遠野市,"https://www.city.tono.iwate.jp/index.cfm/46,53554,295,524,html", 融資,セーフティネット保証4号による認定について ,2022-03-30,,,
遠野市,"https://www.city.tono.iwate.jp/index.cfm/46,53555,295,524,html", 融資,セーフティネット保証5号による認定について ,2022-03-30,,,
遠野市,"https://www.city.tono.iwate.jp/index.cfm/46,54505,295,643,html",,【遠野市】補助金：「遠野市新型コロナウイルス感染症対策 中小企業等事業資金緊急対策事業費補助金」,2022-04-12,74547,※2022年4月8日更新,
遠野市,"https://www.city.tono.iwate.jp/index.cfm/46,59485,295,643,html",,【遠野市】補助金：遠野市新型コロナウイルス感染症対策 「中小企業等事業転換支援事業費補助金」 について,2022-10-06,85946,※2022年9月8日更新　申請期限2022年11月30日,
