area,url,category,title,date
二戸市,https://www.city.ninohe.lg.jp/info/2413, 給付金,地域企業家賃支援給付金 ,2022-02-15
二戸市,https://www.city.ninohe.lg.jp/Info/2412, 給付金,二戸市持続化支援給付金 ,2022-02-15
二戸市,https://www.city.ninohe.lg.jp/info/2222, 補助金,新事業展開等支援事業の支援 ,2022-02-15
二戸市,https://www.city.ninohe.lg.jp/Info/2221, 給付金,二戸市地域イベント等開催支援事業補助金 ,2022-02-15
二戸市,https://www.city.ninohe.lg.jp/info/1914, 融資,中小企業等に対する資金融資制度等のお知らせ ,2022-02-15
二戸市,https://www.city.ninohe.lg.jp/info/1896, 支援情報,新型コロナウイルス感染症で影響を受ける事業者の皆様へ ,2022-02-15
