area,url,category,title,date,id,comment,body
酒田市,http://www.city.sakata.lg.jp/sangyo/kigyo/shienseido/hanrokakudaisien.html, 補助金,販路拡大支援補助金 ,2022-03-30,,,
酒田市,http://www.city.sakata.lg.jp/sangyo/kigyo/shienseido/nethosyouseido.html, 融資,セーフティネット保証制度（中小企業信用保険法第2条第5項及び第6項） ,2022-03-30,,,
酒田市,https://www.city.sakata.lg.jp/kenko/iryo/kansen/covid_19/keizaishien/index.html, 支援情報,事業者向け支援のまとめ情報 ,2022-03-30,,,
酒田市,https://www.city.sakata.lg.jp/sangyo/kigyo/shienseido/shokohojokin202301.html,,【酒田市】補助金・助成金 ：「原油価格・物価高騰緊急支援補助金の交付について」,2023-01-25,93755,※2022年12月23日更新　申請期限2023年2月28日,
酒田市,https://www.city.sakata.lg.jp/kenko/iryo/kansen/covid_19/keizaishien/koronakigyousien.html,,【酒田市】コロナに関する情報提供：「企業への支援策について（新型コロナウイルス感染症関連）」,2023-01-25,93828,※2022年12月28日更新,
