area,url,category,title,date
飯豊町,https://www.town.iide.yamagata.jp/002/subsidy-ltci-training.html, 補助,令和3年度飯豊町介護職員初任者研修支援事業 ,2022-02-16
飯豊町,https://www.town.iide.yamagata.jp/012/risihokyuu.html, 利子補給,中小企業緊急金融対策利子・保証料補給制度 ,2022-02-16
飯豊町,https://www.town.iide.yamagata.jp/012/safetynet.html, 融資,セーフティネット保証制度 ,2022-02-16
飯豊町,https://www.town.iide.yamagata.jp/012/koyoutyouseijoseikin.html, 相談,新型コロナウイルス感染症拡大に伴う雇用調整助成金の申請サポート ,2022-02-16
飯豊町,https://www.town.iide.yamagata.jp/005/tyousyuuyuuyo.html, 税制,町税を一時に納付(納入)することが困難な方へ ,2022-02-16
