area,url,category,title,date
関川村,http://www.vill.sekikawa.niigata.jp/tourism/3915/index.html, 協力金,【まん延防止等重点措置】新型コロナウイルス感染症拡大防止協力金 ,2022-02-22
関川村,http://www.vill.sekikawa.niigata.jp/life/2452/2623/2626/index.html, 融資,国セーフティネット保証4号について ,2022-02-22
関川村,http://www.vill.sekikawa.niigata.jp/life/2452/2623/2628/index.html, 融資,国セーフティネット保証5号について ,2022-02-22
関川村,http://www.vill.sekikawa.niigata.jp/life/3289/3290/2632/index.html,, 先端設備等導入基本計画について ,2022-02-22
関川村,http://www.vill.sekikawa.niigata.jp/life/2452/2623/index.html, 支援情報,新型コロナウイルス感染症によって影響を受ける中小企業等の支援について ,2022-02-22
