area,url,category,title,date
釧路市,https://www.city.kushiro.lg.jp/sangyou/b_shien/yuushi/0001.html, 融資,セーフティネット保証制度について ,2022-03-19
釧路市,https://www.city.kushiro.lg.jp/sangyou/san_shien/kigyoricchi/page00009_00001.html,, 先端設備等導入計画および導入促進基本計画 ,2022-03-19
釧路市,"新型コロナウイルス感染症の影響を受ける中小企業者を支援するため、
            　2020年(令和２年)４月30日の法改正により、事業用家屋と構築物が対象に追加されました。",, 沿道飲食店等の路上利用に伴う道路占用許可基準緩和への手続き支援について ,2022-03-19
釧路市,https://www.city.kushiro.lg.jp/sangyou/b_shien/shougyou/shinsei/page00016.html, 支援情報,新型コロナウイルス感染症の流行に伴い影響を受けている事業者さまへ ,2022-03-19
