area,url,category,title,date
紋別市,https://mombetsu.jp/soshiki/sangyo/syoukou/news/2017-0405-1006-127.html, 補助金,紋別市中小企業チャレンジ支援事業 ,2022-02-27
紋別市,https://mombetsu.jp/hataraku/finance-shop.html, 補助金,紋別市商業環境整備促進事業 ,2022-02-27
紋別市,https://mombetsu.jp/hataraku/2018-0824-1041-127.html, 補助金,中心商店街空き地空き店舗活用支援事業 ,2022-02-27
紋別市,https://mombetsu.jp/soshiki/sangyo/syoukou/news/2020-1209-1050-160.html, 支援情報,新型コロナウイルス感染症に関する中小企業支援について（紋別市） ,2022-02-27
紋別市,https://mombetsu.jp/soshiki/sangyo/syoukou/news/2020-1209-1058-160.html, 融資,新型コロナウイルス感染症に関する中小企業支援について ,2022-02-27
紋別市,https://mombetsu.jp/soshiki/sangyo/syoukou/news/2018-0622-1559-92.html,, 中小企業等経営強化法に基づく「先端設備等導入計画」の申請受付について ,2022-02-27
紋別市,https://mombetsu.jp/soshiki/somu/zeimu/news/2020-0522-1139-137.html, 税制,「新型コロナウイルス感染症に係る国民健康保険税の減免について（個人向け） ,2022-02-27
