area,url,category,title,date,id,comment,body
松阪市,https://www.city.matsusaka.mie.jp/soshiki/35/sefuhosyo.html, 融資,セーフティネット保証制度について ,2022-03-30,,,
松阪市,https://www.city.matsusaka.mie.jp/site/covid-19/, 支援情報,松阪市新型コロナウイルス感染症特設サイト ,2022-03-30,,,
松阪市,https://www.city.matsusaka.mie.jp/soshiki/35/kinyuusiennkeieisoudannmadoguti.html, 支援情報,新型コロナウイルスに関する中小企業・小規模企業への金融支援のご案内および経営相談窓口の設置について ,2022-03-30,,,
松阪市,https://www.miesc.or.jp/support/contents/703/,,セミナー・イベント：「ビジネスセミナー（経営計画編）」の受講者を募集します,2022-12-21,91500,※2022年12月21日更新　申込期限2023年3月14日,
松阪市,https://www.miesc.or.jp/support/contents/702/,,セミナー・イベント：「ビジネスセミナー（労務管理編）」の受講者を募集します,2022-12-21,91499,※2022年12月21日更新　申込期限2023年2月17日,
松阪市,https://www.city.matsusaka.mie.jp/site/matsusaka-sangyo/business-seminar2023-03-16.html,,【松阪市】セミナー・イベント：「ビジネスセミナー（経営計画編）の開催について」,2023-01-10,92345,※2022年12月21日更新　申請期限2023年3月14日,
松阪市,https://www.city.matsusaka.mie.jp/site/matsusaka-sangyo/business-seminar2023-02-21.html,,【松阪市】セミナー・イベント：「ビジネスセミナー（労務管理編）の開催について」,2023-01-10,92348,※2022年12月21日更新　申請期限2023年2月17日,
