area,url,category,title,date
糸満市,https://www.city.itoman.lg.jp/docs/2021072900027/, 融資,セーフティネット保証制度のご案内 ,2022-03-16
糸満市,http://www.city.itoman.lg.jp/docs/2020042300034/files/daigodan.pdf, 支援情報,糸満市新型コロナウイルス感染防止対策等に関する緊急対策事業（第5弾） ,2022-03-16
糸満市,http://www.city.itoman.lg.jp/docs/2020080600059/, 支援情報,【新型コロナウイルス感染症】個人・事業者向け各種支援まとめ ,2022-03-16
糸満市,http://www.city.itoman.lg.jp/docs/2020041500022/, 相談,新型コロナウイルスに関する中小企業・小規模事業者向け経営相談窓口について ,2022-03-16
糸満市,https://www.city.itoman.lg.jp/docs/2021053100026/, 手当金,国民健康保険における新型コロナウイルス感染症に伴う傷病手当金 ,2022-03-16
