area,url,category,title,date
伊達市,https://www.city.fukushima-date.lg.jp/soshiki/20/46554.html, 補助金,伊達市新型コロナウイルス感染症対策事業継続奨励金（第3弾） ,2021-12-25
伊達市,https://www.city.fukushima-date.lg.jp/soshiki/20/43444.html, 補助金,伊達市新しい生活様式導入補助金 ,2021-12-25
伊達市,https://www.city.fukushima-date.lg.jp/soshiki/20/46300.html, 補助金,伊達市資格取得等支援補助金 ,2021-12-25
伊達市,https://www.city.fukushima-date.lg.jp/soshiki/20/46240.html, 補助金,伊達市新分野参入等設備投資応援補助金 ,2021-12-25
伊達市,https://www.city.fukushima-date.lg.jp/soshiki/20/39665.html, 融資,新型コロナウイルス感染症で影響を受ける事業者の皆さんへ ,2021-12-25
伊達市,https://www.city.fukushima-date.lg.jp/soshiki/20/28974.html,, 中小企業等経営強化法に基づく先端設備等導入計画について ,2021-12-25
伊達市,https://www.city.fukushima-date.lg.jp/soshiki/20/40630.html, 信用保証料補助・利子補給,伊達市新型コロナウイルス感染症対策支援事業について（信用保証料補助・利子補給） ,2021-12-25
伊達市,https://www.city.fukushima-date.lg.jp/soshiki/92/41100.html, 支援情報,新型コロナウイルス感染症の影響に対する各種支援制度のご案内 ,2021-12-25
伊達市,https://www.city.fukushima-date.lg.jp/soshiki/7/42250.html, 税制,新型コロナウイルス感染症の影響による固定資産税の軽減措置等について ,2021-12-25
