area,url,category,title,date
鎌倉市,https://www.city.kamakura.kanagawa.jp/syougaijisha/syoureikin.html, 奨励金,鎌倉市障害者雇用奨励金 ,2022-03-16
鎌倉市,http://www.city.kamakura.kanagawa.jp/shoukou/sien/yuusi.html, 融資,中小企業融資制度 ,2022-03-16
鎌倉市,https://www.city.kamakura.kanagawa.jp/shoukou/sien/kinkyu.html, 融資・相談,新型コロナウイルス感染症に関する中小企業支援について ,2022-03-16
鎌倉市,https://www.city.kamakura.kanagawa.jp/shoukou/sien/safety4.html, 融資,経営安定関連保証（新型コロナウイルス感染症に関するセーフティネット保証） ,2022-03-16
鎌倉市,https://www.city.kamakura.kanagawa.jp/shoukou/sien/safety.html, 融資,経営安定関連保証（セーフティネット保証制度中小企業信用保険法第2条第5項） ,2022-03-16
鎌倉市,https://www.city.kamakura.kanagawa.jp/shoukou/sien/keiei-soudan.html, 相談,中小企業診断士による経営相談の実施について ,2022-03-16
鎌倉市,https://www.city.kamakura.kanagawa.jp/shoukou/bizsightopen.html,, 鎌倉市企業・求人情報発信サイト「鎌倉worker'sstation」 ,2022-03-16
鎌倉市,https://www.city.kamakura.kanagawa.jp/shoukou/map_tokusetu.html, 掲載事業者受付中,鎌倉お店紹介特設ページ　お持ち帰り・宅配マップ ,2022-03-16
