area,url,category,title,date,body
美浜町,https://www.town.fukui-mihama.lg.jp/site/covid-19/6505.html, 支援金,がんばる美浜町事業者応援支援金 ,2022-03-30,
美浜町,https://www.town.fukui-mihama.lg.jp/site/covid-19/686.html, 融資,新型コロナウイルス感染症に関するセーフティネット保証4号認定のご案内 ,2022-03-30,
美浜町,https://www.town.fukui-mihama.lg.jp/site/covid-19/687.html, 融資,新型コロナウイルス感染症に関するセーフティネット保証5号認定のご案内 ,2022-03-30,
美浜町,https://www.town.fukui-mihama.lg.jp/site/covid-19/133.html, 融資,危機関連保証の認定のご案内 ,2022-03-30,
美浜町,https://www.town.fukui-mihama.lg.jp/site/covid-19/363.html,, 事業者の方に対する情報 ,2022-03-30,
