area,url,category,title,date,body
高浜町,https://www.town.takahama.fukui.jp/page/sanngyousinnkou/p006861.html, 支援金,令和3年度高浜町内夏期観光事業者支援金 ,2022-01-10,
高浜町,https://www.town.takahama.fukui.jp/page/sanngyousinnkou/p006726.html, 助成金,高浜町新型コロナ感染拡大防止対策助成金 ,2022-01-10,
高浜町,https://www.town.takahama.fukui.jp/page/sougouseisaku/p006302.html,, 高浜町内事業者様が使える給付制度 ,2022-01-10,
高浜町,http://www.town.takahama.fukui.jp/page/sanngyousinnkou/p006304.html, 融資,セーフティネット保証制度について ,2022-01-10,"(function(d,s,id){varjs,fjs=d.getElementsByTagName(s)[0];if(d.getElementById(id))return;js=d.createElement(s);js.id=id;js.src='https://connect.facebook.net/ja_JP/sdk.js#xfbml=1&version=v3.2';fjs.parentNode.insertBefore(js,fjs);}(document,'script','facebook-jssdk'));<pclass=""nojs"">当サイトではJavaScriptを使用しています。<br>ブラウザの設定でJavaScriptの使用を無効にしている場合、一部の機能が正確に動作しない恐れがあります。<br>当サイトをご覧の際はJavaScriptの使用を有効にしてください。</p>福井県高浜町Takahama-townキーワードから探す検索のしかた文字サイズ標準拡大背景色黒黄青標準Languageくらし・手続き産業・ビジネス"
高浜町,https://www.town.takahama.fukui.jp/page/sanngyousinnkou/p003552.html,, 中小企業等経営強化法に基づく「先端設備等導入計画」の認定申請受付について ,2022-01-10,
高浜町,https://www.town.takahama.fukui.jp/page/sougouseisaku/p006259_d/fil/soudanmadoguti.pdf, 相談,新型コロナウイルス感染症に関する各種相談窓口一覧 ,2022-01-10,
