area,url,category,title,date
白石町,https://www.town.shiroishi.lg.jp/jyuumin/seikatsu/hoken_kourei/_3752/_3757/_3140.html, 支給,新型コロナウイルス感染症に伴う傷病手当金の支給 ,2021-12-02
白石町,https://www.town.shiroishi.lg.jp/jyuumin/fukushi/iryoukikan/_3673.html, 貸付,新型コロナウイルス感染症の影響を踏まえた生活福祉資金貸付制度における緊急小口資金等の特例貸付（個人向け） ,2021-12-02
白石町,https://www.town.shiroishi.lg.jp/chousei_machi/nousanshou/_3659/_1081/_3549.html, 融資,新型コロナウイルス感染症にかかるセーフティーネット保証の認定手続きについて ,2021-12-02
白石町,https://www.town.shiroishi.lg.jp/chousei_machi/nousanshou/_3659/_1081/_3042.html,, 中小企業等経営強化法に基づく導入促進基本計画について ,2021-12-02
白石町,https://www.town.shiroishi.lg.jp/jyuumin/seikatsu/_2049/_2401/_3744.html, 税制,新型コロナウイルス感染症による法人町民税の申告・納付期限の延長 ,2021-12-02
白石町,https://www.town.shiroishi.lg.jp/chousei_machi/nousanshou/_3659/_1081/_4420.html, 相談,中小企業・小規模事業者対象の特別相談窓口について ,2021-12-02
