area,url,category,title,date
結城市,https://www.city.yuki.lg.jp/page/page007053.html, 支援金,結城市わくわく茨城生活実現事業移住支援金 ,2022-02-23
結城市,https://www.city.yuki.lg.jp/page/page001319.html, 奨励金,結城市の企業誘致優遇制度 ,2022-02-23
結城市,https://www.city.yuki.lg.jp/page/page000708.html, 融資,結城市中小企業事業資金融資あっせん制度 ,2022-02-23
結城市,https://www.city.yuki.lg.jp/page/page005106.html,, 生産性向上特別措置法に基づく先端設備導入計画について ,2022-02-23
結城市,https://www.city.yuki.lg.jp/page/page007047.html, 支援情報,新型コロナウイルス感染症に関する中小企業支援策 ,2022-02-23
結城市,https://www.city.yuki.lg.jp/page/page000088.html, 相談,令和4年度市・県民税申告相談会場及び日程 ,2022-02-23
