area,url,category,title,date
東温市,https://www.city.toon.ehime.jp/site/140/13578.html, 応援金,東温市新型コロナウイルス感染症対策中小零細企業応援給付金(第2弾)(県・市連携えひめ版応援金(第2弾)) ,2021-11-05
東温市,https://www.city.toon.ehime.jp/site/140/7566.html, 助成金,東温市新型コロナウイルス感染症対策雇用維持助成金 ,2021-11-05
東温市,https://www.city.toon.ehime.jp/site/140/7568.html,, 政府系金融機関の新型コロナウイルス感染症特別貸付に係る利子を補給します ,2021-11-05
東温市,https://www.city.toon.ehime.jp/soshiki/13/2068.html, 補助金,東温市中小企業振興資金融資制度補助金 ,2021-11-05
東温市,https://www.city.toon.ehime.jp/soshiki/13/2067.html, 融資,東温市中小企業振興資金融資制度 ,2021-11-05
東温市,https://www.city.toon.ehime.jp/site/140/7004.html,, セーフティネット保証制度及び危機関連保証制度について ,2021-11-05
東温市,https://www.city.toon.ehime.jp/soshiki/13/1873.html,, 生産性向上特別措置法に基づく導入促進基本計画 ,2021-11-05
東温市,https://www.city.toon.ehime.jp/site/140/7102.html, 相談,市の各種相談窓口 ,2021-11-05
