area,url,category,title,date
松前町,https://www.town.masaki.ehime.jp/soshiki/12/18727.html, 助成金,離職者等正規雇用移行緊急支援事業助成金 ,2021-12-10
松前町,https://www.town.masaki.ehime.jp/soshiki/12/17473.html, 補助金,新型コロナウイルス感染拡大予防設備整備費補助金 ,2021-12-10
松前町,https://www.town.masaki.ehime.jp/soshiki/12/18499.html, 応援金,松前町えひめ版県・市町連携事業応援金(第2弾) ,2021-12-10
松前町,https://www.town.masaki.ehime.jp/soshiki/12/17415.html, 補助金,新型コロナウイルス感染症対策新ビジネスモデル補助金 ,2021-12-10
松前町,https://www.town.masaki.ehime.jp/soshiki/12/13648.html, 助成金,新型コロナウイルス感染症対策緊急地域雇用維持助成金 ,2021-12-10
松前町,https://www.town.masaki.ehime.jp/soshiki/12/13544.html, 補助金,新型コロナウイルス感染症対策雇用調整助成金等申請事務委任手数料補助金 ,2021-12-10
松前町,https://www.town.masaki.ehime.jp/soshiki/46/16706.html, 補助金,松前町高齢者福祉施設等における新型コロナウイルス感染症検査費用補助金 ,2021-12-10
松前町,https://www.town.masaki.ehime.jp/soshiki/12/12846.html, 融資,セーフティネット保証4号認定 ,2021-12-10
松前町,https://www.town.masaki.ehime.jp/soshiki/12/12847.html, 融資,セーフティネット保証5号認定 ,2021-12-10
松前町,https://www.town.masaki.ehime.jp/soshiki/12/12848.html, 融資,危機関連保証の認定 ,2021-12-10
松前町,https://www.town.masaki.ehime.jp/soshiki/12/15886.html,, 生産性向上特別措置法に基づく「先端設備等導入計画」について ,2021-12-10
松前町,https://www.town.masaki.ehime.jp/site/coronavirus/16611.html,, 新型コロナウイルス感染症に伴う中小企業者への支援情報について（令和3年度） ,2021-12-10
松前町,https://www.town.masaki.ehime.jp/site/coronavirus/13611.html,, 「コロナに負けるな！」町内のテイクアウト・デリバリー情報を発信します ,2021-12-10
