area,url,category,title,date,id,comment,body
松野町,https://www.town.matsuno.ehime.jp/site/kansen-covid19/6250.html, 補助金,新型コロナウイルス感染症の影響を受けた町内の中小企業の方への支援制度や情報提供等についてNo2 ,2022-03-30,,,
松野町,http://www.town.matsuno.ehime.jp/reiki_int/reiki_honbun/o264RG00000718.html, 補助金,松野町新型コロナウイルス感染症対策資金利子補給補助金 ,2022-03-30,,,
松野町,http://www.town.matsuno.ehime.jp/site/kansen-covid19/6352.html, 支援情報,新型コロナウイルス感染症の影響を受けた町内の中小企業の方への支援制度 ,2022-03-30,,,
松野町,http://www.town.matsuno.ehime.jp/uploaded/attachment/3050.pdf, 支援情報,新型コロナウイルス感染症関連支援制度 ,2022-03-30,,,
松野町,https://www.town.matsuno.ehime.jp/soshiki/3/14766.html,,【松野町】補助金・助成金：「松野町新型コロナウイルス感染症対策資金利子補給補助金の交付について」,2025-02-12,148695,※2025年1月21日更新　申請期限2025年2月28日,
松野町,https://www.town.matsuno.ehime.jp/soshiki/3/14741.html,,【松野町】補助金・助成金：「松野町新型コロナウイルス感染症対応融資資金利子補給補助金の交付について」,2025-02-12,148697,※2025年1月21日更新　申請期限2025年2月28日,
