area,url,category,title,date
石川県,https://www.pref.ishikawa.lg.jp/kinyuu/keieishien/kyouryokukin9.html, 協力金,石川県新型コロナウイルス感染拡大防止協力金（第9次） ,2022-03-27
石川県,https://www.pref.ishikawa.lg.jp/kinyuu/keieishien/kyouryokukin8.html, 協力金,石川県新型コロナウイルス感染拡大防止協力金（第8次） ,2022-03-27
石川県,https://www.pref.ishikawa.lg.jp/kinyuu/keieishien/jigyo_fukkatsu.html, 支援金,石川県事業復活支援金 ,2022-03-27
石川県,https://www.pref.ishikawa.lg.jp/ansin/serviceteikyoutaisei.html, 補助金,石川県新型コロナウイルス感染症流行下における介護サービス事業所等のサービス提供体制確保事業 ,2022-03-27
石川県,https://www.pref.ishikawa.lg.jp/kinyuu/kinyuu/korona.html, 融資,新型コロナウイルス感染症経営改善支援特別融資 ,2022-03-27
石川県,https://www.pref.ishikawa.lg.jp/kenmin/covid19/bizsupport.html,, 新型コロナウイルス感染症の影響を受ける事業者のみなさまへの支援制度 ,2022-03-27
石川県,https://www.pref.ishikawa.lg.jp/nousei/covid19/support.html,, 新型コロナウイルス感染症に関する農林漁業者向け支援制度 ,2022-03-27
石川県,https://ishikawa-anshin-ninsyou.jp/, 認証制度,いしかわ新型コロナ対策認証制度 ,2022-03-27
石川県,https://www.pref.ishikawa.lg.jp/zaisei/covid19/shien.html,, 新型コロナウイルス感染症の影響を受ける方への各種支援制度(個人向け) ,2022-03-27
