area,url,category,title,date
石川県,https://ishikawa-shienkin.jp/keieijizoku/, 支援金,石川県経営持続月次支援金 ,2021-12-08
石川県,https://www.pref.ishikawa.lg.jp/kinyuu/kinyuu/korona.html, 融資,新型コロナウイルス感染症経営改善支援特別融資 ,2021-12-08
石川県,https://www.pref.ishikawa.lg.jp/kenmin/covid19/bizsupport.html,, 新型コロナウイルス感染症の影響を受ける事業者のみなさまへの支援制度 ,2021-12-08
石川県,https://ishikawa-anshin-ninsyou.jp/, 認証制度,いしかわ新型コロナ対策認証制度 ,2021-12-08
石川県,https://www.pref.ishikawa.lg.jp/zaisei/covid19/shien.html,, 新型コロナウイルス感染症の影響を受ける方への各種支援制度(個人向け) ,2021-12-08
