area,url,category,title,date
海津市,https://www.city.kaizu.lg.jp/shisei/0000002363.html, 補助金,海津市中小企業者等応援補助金 ,2022-01-11
海津市,https://www.city.kaizu.lg.jp/shisei/0000002352.html,, 産業振興事業補助金制度のご紹介 ,2022-01-11
海津市,https://www.city.kaizu.lg.jp/shisei/0000001744.html, 融資,セーフティネット保証4号認定(新型コロナウィルス感染症の影響に伴う保証)について ,2022-01-11
海津市,https://www.city.kaizu.lg.jp/shisei/0000000588.html, 融資,セーフティネット保証5号認定のご案内 ,2022-01-11
海津市,https://www.city.kaizu.lg.jp/shisei/0000000716.html,, 先端設備等導入計画の認定による支援について ,2022-01-11
海津市,https://www.city.kaizu.lg.jp/shisei/0000001867.html, 支援情報,事業者の皆さんの支援について ,2022-01-11
