area,url,category,title,date
揖斐川町,https://www.town.ibigawa.lg.jp/0000010129.html, 補助金,揖斐川町新型コロナウイルス感染防止対策店舗等改装支援事業補助金 ,2022-03-27
揖斐川町,https://www.town.ibigawa.lg.jp/0000009920.html,, 揖斐川町内中小企業者等に対する利子補給制度 ,2022-03-27
揖斐川町,https://www.town.ibigawa.lg.jp/0000008992.html, 融資,セーフティネット保証4号認定 ,2022-03-27
揖斐川町,https://www.town.ibigawa.lg.jp/0000008667.html, 融資,セーフティネット保証5号認定 ,2022-03-27
揖斐川町,https://www.town.ibigawa.lg.jp/0000008119.html,, 生産性向上特別措置法に基づく中小企業支援について ,2022-03-27
揖斐川町,https://www.town.ibigawa.lg.jp/0000009409.html, 相談,中小事業者のためのよろず経営相談窓口を設けています ,2022-03-27
