area,url,category,title,date
長与町,https://webtown.nagayo.jp/kiji003602/index.html, 助成金,長与町店舗リフォーム助成事業 ,2022-02-09
長与町,https://webtown.nagayo.jp/kiji003599/index.html, 融資,長与町小規模企業振興資金・長与町小規模企業創業支援資金 ,2022-02-09
長与町,https://webtown.nagayo.jp/kiji0032246/index.html, 融資,セーフティーネット保証制度について ,2022-02-09
長与町,https://webtown.nagayo.jp/kiji003598/index.html,, 中小企業等経営強化法に基づく導入促進基本計画について ,2022-02-09
長与町,https://webtown.nagayo.jp/kiji0032592/index.html, 税制,「新型コロナウイルスの影響により納税が困難な方へ　徴収猶予制度について ,2022-02-09
長与町,https://webtown.nagayo.jp/kiji0032213/index.html, 貸付,一時的な資金の特例貸付（緊急小口資金・総合支援資金）の申請期間延長について(個人向け） ,2022-02-09
